475,Getting Started with Maker Feather AIoT S3 (Arduino IDE),RE-EDIT,FALSE,FALSE,FALSE,FALSE,FALSE,FALSE,Edit Thumbnail,,Use Arduino IDE with ESP32-S3 Maker Feather.,2022-12-06,education,3131,0,Khairul Nizam,Tutorial,Beginner,"MY, SG, TH, WWW",IoT/ESP32,TRUE,https://my.cytron.io/tutorial/getting-started-with-Maker-Feather-AIoT-S3-(ArduinoIDE),"['Arduino IDE', 'IOT', 'ESP32. ESP32-S3', 'Arduino Ecosystem', 'Sensor']","[{'name': 'Maker Feather AIoT S3: Simplifying AIoT with ESP32', 'price': '79', 'quantity': '1'}]",
476,Monitoring Soil Moisture Using Blynk and micro:bit,RE-EDIT,FALSE,TRUE,FALSE,FALSE,FALSE,FALSE,,,IoT plant care with Blynk app.,2022-12-09,education,2356,0,Abdulrahman Alhamed,Tutorial,Beginner,"MY, SG, WWW",micro:bit,TRUE,https://my.cytron.io/tutorial/monitoring-soil-moisture-using-blynk-and-microbit,"['microbit', 'IoT', 'APW kit for microbit', 'micro:bit', 'Wireless & IoT']","[{'name': 'REKA:BIT (with micro:bit V2 included) - Simplifying Robotics with micro:bit', 'price': '142', 'quantity': '1'}, {'name': 'Grove WiFi 8266 - IoT for micro:bit and beyond', 'price': '26', 'quantity': '1'}, {'name': 'Maker Soil Moisture Sensor (Capacitive)', 'price': '19', 'quantity': '1'}, {'name': 'Auto Plant Watering Kit for micro:bit (micro:bit V2 Included)', 'price': '178', 'quantity': '1'}, {'name': 'Auto Plant Watering Kit for micro:bit', 'price': '108', 'quantity': '1'}]",
477,IoT-Based Door Lock Using micro:bit and Blynk,RE-EDIT,FALSE,FALSE,FALSE,FALSE,FALSE,FALSE,Edit Thumbnail,,Smart lock controlled via IoT.,2022-12-19,education,2928,0,Abdulrahman Alhamed,Tutorial,Beginner,"MY, SG, TH, VN, WWW",micro:bit,TRUE,https://my.cytron.io/tutorial/iot-based-door-lock-using-microbit-and-blynk,"['IoT', 'micro:bit', 'micro:bit', 'Wireless & IoT']","[{'name': 'REKA:BIT (with micro:bit V2 included) - Simplifying Robotics with micro:bit', 'price': '142', 'quantity': '1'}, {'name': 'Grove WiFi 8266 - IoT for micro:bit and beyond', 'price': '26', 'quantity': '1'}]",
478,Installation for 8MP Pan Tilt Zoom Camera on Raspberry Pi ,RE-EDIT,FALSE,FALSE,FALSE,FALSE,FALSE,FALSE,Edit Thumbnail,,Tutorial for Arducam PTZ camera.,2022-12-22,education,559,1,Abdul Salam,Tutorial,Intermediate,MY,Raspberry Pi,TRUE,,,,
479,Create an Alarm Clock with micro:bit | Easy for Beginners,RE-EDIT,FALSE,TRUE,FALSE,FALSE,FALSE,FALSE,,,Beginner-friendly micro:bit project.,2022-12-23,education,6234,1,Abdulrahman Alhamed,Tutorial,Beginner,"MY, SG, TH, VN, WWW",micro:bit,TRUE,https://my.cytron.io/tutorial/create-an-alarm-clock-with-micro:bit,"['AlarmClock', 'Microbit', 'Beginner', 'DIY', 'Coding', 'STEM', 'Education', 'Embedded', 'Project', 'Electronics', 'micro:bit', 'Wireless & IoT']","[{'name': 'REKA:BIT (with micro:bit V2 included) - Simplifying Robotics with micro:bit', 'price': '142', 'quantity': '1'}, {'name': 'Grove WiFi 8266 - IoT for micro:bit and beyond', 'price': '26', 'quantity': '1'}]",
480,Build a Shooting Game Using micro:bit,RE-EDIT,FALSE,FALSE,FALSE,FALSE,FALSE,FALSE,Edit Thumbnail,,Simple micro:bit game project.,2022-12-31,education,4912,0,Abdulrahman Alhamed,Project,Beginner,"MY, SG, WWW",micro:bit,TRUE,https://my.cytron.io/tutorial/build-a-shooting-game-using-micro:bit,"['micro:bit', 'Game Development', 'Coding for Kids', 'STEM', 'Microsoft MakeCode', 'Arcade Game', 'Education', 'DIY Electronics', 'Python', 'microcontroller', 'micro:bit']","[{'name': 'Crocodile Clip with Wire (10pcs)', 'price': '6', 'quantity': '1'}, {'name': 'micro:bit Quick Start Kit', 'price': '39', 'quantity': '1'}]",
481,RBT Automatic Plant Watering IoT Project Using Blynk IoT,RE-EDIT,FALSE,FALSE,FALSE,FALSE,FALSE,FALSE,Edit Thumbnail,,School kit IoT project for watering.,2023-01-06,education,2884,3,Hao Zhen,Tutorial,Beginner,"MY, SG, TH, WWW",micro:bit,TRUE,https://my.cytron.io/tutorial/rbt-automatic-plant-watering-iot-project-using-blynk-iot,"['Microbit', 'RBT', 'Automatic Plant Watering System', 'APW kit for microbit', 'Blynk', 'IoT', 'esp8266', 'Reka:bit']","[{'name': 'Grove WiFi 8266 - IoT for micro:bit and beyond', 'price': '26', 'quantity': '1'}, {'name': 'Auto Plant Watering Kit for micro:bit (micro:bit V2 Included)', 'price': '178', 'quantity': '1'}, {'name': 'Auto Plant Watering Kit for micro:bit (without micro:bit)', 'price': '108', 'quantity': '1'}, {'name': 'Auto Plant Watering Kit for micro:bit', 'price': '108', 'quantity': '1'}]",
482,Use micro:bit as a Game Controller for Scratch,RE-EDIT,FALSE,FALSE,FALSE,FALSE,FALSE,FALSE,Edit Thumbnail,,Use micro:bit as input device in Scratch.,2023-01-07,education,3873,0,Abdulrahman Alhamed,Tutorial,Beginner,"MY, SG, TH, VN, WWW",micro:bit,TRUE,https://my.cytron.io/tutorial/play-scratch-games-with-microbit,"['Microbit', 'Scratch', 'Games', 'Coding', 'DIY', 'STEM', 'Education', 'Programming', 'Fun', 'Project', 'micro:bit']","[{'name': 'micro:bit Junior Kit (V2)', 'price': '85', 'quantity': '1'}]",
483,Powered by Raspberry Pi Mark Obtained ,RE-EDIT,FALSE,FALSE,FALSE,FALSE,FALSE,FALSE,Edit Thumbnail,,Benchmark showcase project.,2023-01-11,education,1584,0,engtong,News,Not a project,"MY, SG, TH, WWW",Raspberry Pi,TRUE,,,,
484,Control an Oscillating Table Fan with micro:bit and Servo Motor,RE-EDIT,FALSE,FALSE,FALSE,FALSE,FALSE,FALSE,Edit Thumbnail,,Smart fan project with servo.,2023-01-15,education,6296,0,Abdulrahman Alhamed,Tutorial,Beginner,"MY, SG, TH, VN, WWW",micro:bit,TRUE,https://my.cytron.io/tutorial/make-an-oscillating-table-fan-using-microbit,"['Microbit', 'Fan', 'Oscillating', 'DIY', 'Motor', 'Automation', 'STEM', 'Electronics', 'Coding', 'Project', 'micro:bit']","[{'name': 'REKA:BIT (with micro:bit V2 included) - Simplifying Robotics with micro:bit', 'price': '142', 'quantity': '1'}]",
485,Getting Started With Maker Nano RP2040,RE-EDIT,FALSE,TRUE,FALSE,FALSE,FALSE,FALSE,,,Beginner tutorial for Nano RP2040.,2023-01-31,education,2356,0,Hussien,Tutorial,Beginner,"MY, SG, TH, VN, WWW",RP2040,TRUE,https://my.cytron.io/tutorial/Getting-Started-With-Maker-Nano-RP2040,"['RP2040', 'Arduino', 'RP2040/PICO']",,
486,Lesson 1 : LED Blink,SUBTOPIC,FALSE,FALSE,FALSE,FALSE,FALSE,FALSE,Edit Thumbnail,,First lesson for Maker Nano RP2040.,2023-02-01,education,1040,0,Hussien,Tutorial,Beginner,"MY, SG, TH, VN, WWW",RP2040,TRUE,,,,
487,Lesson 2 : Siren,SUBTOPIC,FALSE,FALSE,FALSE,FALSE,FALSE,FALSE,Edit Thumbnail,,Build siren with RP2040 board.,2023-02-01,education,902,0,Hussien,Tutorial,Beginner,"MY, SG, TH, VN, WWW",RP2040,TRUE,,,,
488,Lesson 3 : Digital Input,SUBTOPIC,FALSE,FALSE,FALSE,FALSE,FALSE,FALSE,Edit Thumbnail,,Learn digital input with Maker Nano RP2040.,2023-02-02,education,951,0,Hussien,Tutorial,Beginner,"MY, SG, TH, VN, WWW",RP2040,TRUE,,,,
489,Lesson 4 : Analog Input,SUBTOPIC,FALSE,FALSE,FALSE,FALSE,FALSE,FALSE,Edit Thumbnail,,Use analog sensors with RP2040.,2023-02-02,education,899,0,Hussien,Tutorial,Beginner,"MY, SG, TH, VN, WWW",RP2040,TRUE,,,,
490,9 Reasons Why Industry Started to Adopt Raspberry Pi,UPDATED,TRUE,TRUE,TRUE,TRUE,FALSE,FALSE,,,Blog on industrial Pi adoption.,2023-02-02,industry,8268,2,Yo Nutchanon,Tutorial,Not a project,"MY, SG, TH, WWW",Raspberry Pi,TRUE,https://my.cytron.io/tutorial/9-reasons-why-industry-started-to-adopt-raspberry-pi,"['Raspberry Pi', 'CM4', 'edgebox', 'industrial', 'pi4', 'Raspberry Pi']","[{'name': 'reTerminal - RPi CM4 4G RAM 32GB and 5-Inch Cap Multi-Touch Screen', 'price': '1045', 'quantity': '1'}, {'name': 'Raspberry Pi CM4 Wireless 4G RAM Lite (no eMMC) and Kits', 'price': 'N/A', 'quantity': '1'}, {'name': 'EdgeBox RPi 200 - Industrial Edge Controller with CM4', 'price': '1299', 'quantity': '1'}, {'name': 'EdgeLogix RPi 1000 Industrial Controller WiFi CM4 8GB RAM 32GB eMMC', 'price': '2525', 'quantity': '1'}, {'name': 'IRIV PiControl - IR4.0 Industrial Controller', 'price': '1345', 'quantity': '1'}]",
491,Build a Step Counter with micro:bit to Track Your Daily Activity,RE-EDIT,FALSE,FALSE,FALSE,FALSE,FALSE,FALSE,Edit Thumbnail,,Fitness tracker project with micro:bit.,2023-02-04,education,3558,1,Abdulrahman Alhamed,Tutorial,Beginner,"MY, SG, TH, VN, WWW",micro:bit,TRUE,https://my.cytron.io/tutorial/step-counter-with-microbit,"['Microbit', 'StepCounter', 'Fitness', 'DIY', 'Activity', 'Sensor', 'Coding', 'STEM', 'Electronics', 'Project', 'micro:bit']","[{'name': 'micro:bit Junior Kit (V2)', 'price': '85', 'quantity': '1'}]",
492,Lesson 5 : Light Dependent Resistor,SUBTOPIC,FALSE,FALSE,FALSE,FALSE,FALSE,FALSE,Edit Thumbnail,,Tutorial on using LDR sensor.,2023-02-07,education,861,0,Hussien,Tutorial,Beginner,"MY, SG, TH, VN, WWW",RP2040,TRUE,,,,
493,Lesson 6 : Temperature Sensor,SUBTOPIC,FALSE,FALSE,FALSE,FALSE,FALSE,FALSE,Edit Thumbnail,,Measure temperature with Maker Nano RP2040.,2023-02-07,education,790,0,Hussien,Tutorial,Beginner,"MY, SG, WWW",RP2040,TRUE,,,,
494,Lesson 7 : DC Motor,SUBTOPIC,FALSE,FALSE,FALSE,FALSE,FALSE,FALSE,Edit Thumbnail,,Drive DC motors with Maker Nano RP2040.,2023-02-07,education,492,0,Hussien,Tutorial,Beginner,"MY, SG, WWW",RP2040,TRUE,,,,
495,Lesson 8 : Neopixel,SUBTOPIC,FALSE,FALSE,FALSE,FALSE,FALSE,FALSE,Edit Thumbnail,,Control RGB LEDs using RP2040.,2023-02-07,education,508,0,Hussien,Tutorial,Beginner,"MY, SG, WWW",RP2040,TRUE,,,,
496,Project 1 : Knight Rider,SUBTOPIC,FALSE,FALSE,FALSE,FALSE,FALSE,FALSE,Edit Thumbnail,,LED chasing lights project.,2023-02-07,education,504,0,Hussien,Tutorial,Beginner,"MY, SG, WWW",RP2040,TRUE,https://my.cytron.io/tutorial/getting-started-with-maker-nano-rp2040-project-1-knight-rider,,,
497,Project 2 : Interactive Traffic Light,SUBTOPIC,FALSE,FALSE,FALSE,FALSE,FALSE,FALSE,Edit Thumbnail,,Build traffic light simulation with RP2040.,2023-02-07,education,618,0,Hussien,Tutorial,Beginner,"MY, SG, WWW",RP2040,TRUE,,,,
498,Project 3 : Temperature Alarm,SUBTOPIC,FALSE,FALSE,FALSE,FALSE,FALSE,FALSE,Edit Thumbnail,,Create temperature alarm system.,2023-02-07,education,429,0,Hussien,Tutorial,Beginner,"MY, SG, WWW",RP2040,TRUE,,,,
499,Project 4 : Light Theremin,SUBTOPIC,FALSE,FALSE,FALSE,FALSE,FALSE,FALSE,Edit Thumbnail,,Musical project using light sensors.,2023-02-07,education,404,0,Hussien,Tutorial,Beginner,"MY, SG, WWW",RP2040,TRUE,,,,
500,6 Effective Ways to Remove 3D Prints from The Bed,RE-EDIT,FALSE,FALSE,FALSE,FALSE,FALSE,FALSE,Edit Thumbnail,,Tips for removing stuck prints.,2023-02-07,education,2217,0,Abdulrahman Alhamed,Tutorial,Beginner,"MY, SG, TH, VN, WWW",3DP,TRUE,https://my.cytron.io/tutorial/6-effective-ways-to-remove-3d-prints-from-the-bed,"['3DPrinting', '3D Modelling']",,
501,Getting Started With Maker Nano RP2040 & Blynk IoT,RE-EDIT,FALSE,TRUE,FALSE,FALSE,FALSE,FALSE,,,IoT with RP2040 board + Blynk.,2023-02-07,education,1698,0,Hussien,Tutorial,Beginner,"MY, SG, WWW",RP2040,TRUE,https://my.cytron.io/tutorial/getting-started-with-maker-nano-rp2040-and-blynk-iot,"['RP2040/PICO', 'Wireless & IoT']","[{'name': 'Grove WiFi 8266 - IoT for micro:bit and beyond', 'price': '26', 'quantity': '1'}, {'name': 'Maker Nano RP2040: Simplifying Projects with Raspberry Pi RP2040', 'price': '39', 'quantity': '1'}, {'name': 'Maker Nano RP2040 Getting Started Kits', 'price': '58', 'quantity': '1'}]",
502,Lesson 1 : Getting Connected,SUBTOPIC,FALSE,TRUE,FALSE,FALSE,FALSE,FALSE,,,Basics of connecting RP2040 hardware.,2023-02-09,education,574,0,Hussien,Tutorial,Beginner,"MY, SG, WWW",RP2040,TRUE,,,,
503,Lesson 2 : Simple LED Control,SUBTOPIC,FALSE,TRUE,FALSE,FALSE,FALSE,FALSE,,,Control LEDs using RP2040.,2023-02-09,education,561,0,Hussien,Tutorial,Beginner,"MY, SG, WWW",RP2040,TRUE,,,,
504,"Display Date, Time, and Temperature on an LCD with micro:bit",RE-EDIT,FALSE,FALSE,FALSE,FALSE,FALSE,FALSE,Edit Thumbnail,,Real-time clock and temperature display.,2023-02-11,education,3521,0,Abdulrahman Alhamed,Tutorial,Beginner,"MY, SG, TH, VN, WWW",micro:bit,TRUE,https://my.cytron.io/tutorial/displaying-real-time-info-on-an-lcd-with-microbit,"['Microbit', 'LCD', 'Display', 'RealTime', 'Date', 'Time', 'Temperature', 'DIY', 'STEM', 'Electronics', 'micro:bit', 'Wireless & IoT']","[{'name': 'REKA:BIT (with micro:bit V2 included) - Simplifying Robotics with micro:bit', 'price': '142', 'quantity': '1'}, {'name': 'Grove WiFi 8266 - IoT for micro:bit and beyond', 'price': '26', 'quantity': '1'}]",
505,Lesson 3 : Push Button As Input,SUBTOPIC,FALSE,TRUE,FALSE,FALSE,FALSE,FALSE,,,Learn digital inputs with RP2040.,2023-02-13,education,755,0,Hussien,Tutorial,Beginner,"MY, SG, WWW",RP2040,TRUE,,,,
506,Lesson 4 : Analog Input,SUBTOPIC,FALSE,TRUE,FALSE,FALSE,FALSE,FALSE,,,Use analog sensors with Maker Nano RP2040.,2023-02-13,education,573,0,Hussien,Tutorial,Beginner,"MY, SG, WWW",RP2040,TRUE,,,,
507,Lesson 5 : Temperature Sensor,SUBTOPIC,FALSE,TRUE,FALSE,FALSE,FALSE,FALSE,,,Another temp sensor tutorial (variation).,2023-02-13,education,558,0,Hussien,Tutorial,Beginner,"MY, SG, WWW",RP2040,TRUE,,,,
508,Lesson 6 : Neopixel Color,SUBTOPIC,FALSE,TRUE,FALSE,FALSE,FALSE,FALSE,,,Neopixel RGB projects with RP2040.,2023-02-13,education,492,0,Hussien,Tutorial,Beginner,"MY, SG, WWW",RP2040,TRUE,,,,
509,Lesson 7 : Motor Speed Controller,SUBTOPIC,FALSE,TRUE,FALSE,FALSE,FALSE,FALSE,,,Control motor speed with PWM.,2023-02-13,education,576,0,Hussien,Tutorial,Beginner,"MY, SG, WWW",RP2040,TRUE,,,,
510,Lesson 8 : Going Mobile,SUBTOPIC,FALSE,TRUE,FALSE,FALSE,FALSE,FALSE,,,Mobile robot basics with RP2040.,2023-02-13,education,481,0,Hussien,Tutorial,Beginner,"MY, SG, WWW",RP2040,TRUE,,,,
511,Creating a 3D Printed QR Code: A Step-by-Step Guide,RE-EDIT,FALSE,FALSE,FALSE,FALSE,FALSE,FALSE,Edit Thumbnail,,Create scannable QR code via 3D printing.,2023-02-14,education,4701,1,Abdulrahman Alhamed,Tutorial,Beginner,"MY, SG",3DP,TRUE,https://my.cytron.io/tutorial/creating-a-3d-printed-qr-code,"['3DPrinting', 'QRCode', 'DIY', 'Maker', 'Design', 'PrintingTips', 'Tech', 'Innovation', '3D Modelling']","[{'name': 'Creality Ender-3 V3 KE 3D Printer + 1KG PLA', 'price': '1497', 'quantity': '1'}]",
512,Create a Tilt-Controlled Maze Game with micro:bit,RE-EDIT,FALSE,FALSE,FALSE,FALSE,FALSE,FALSE,Edit Thumbnail,,Play maze game using tilt sensor input.,2023-02-20,education,7750,0,Abdulrahman Alhamed,Tutorial,Beginner,"MY, SG, TH, VN, WWW",micro:bit,TRUE,https://my.cytron.io/tutorial/diy-microbit-maze-game,"['Microbit', 'Maze', 'Game', 'DIY', 'Coding', 'STEM', 'Education', 'Programming', 'Project', 'Electronics', 'micro:bit']","[{'name': 'micro:bit Junior Kit (V2)', 'price': '85', 'quantity': '1'}]",
513,Test Your 3D Printer with These Calibration Models,RE-EDIT,FALSE,FALSE,FALSE,FALSE,FALSE,FALSE,Edit Thumbnail,,List of test prints for calibration.,2023-02-22,education,4717,0,Abdulrahman Alhamed,Tutorial,Beginner,"MY, SG",3DP,TRUE,https://my.cytron.io/tutorial/test-your-3d-printer-with-these-calibration-models,"['3DPrinting', 'Calibration', 'TestPrint', 'DIY', 'Maker', 'PrintQuality', '3D Modelling']",,
514,Display Real-Time Temperature and Humidity on an OLED with micro:bit,RE-EDIT,FALSE,FALSE,FALSE,FALSE,FALSE,FALSE,Edit Thumbnail,,Show DHT sensor data on OLED.,2023-02-23,education,4625,0,Abdulrahman Alhamed,Tutorial,Beginner,"MY, SG, TH, VN, WWW",micro:bit,TRUE,https://my.cytron.io/tutorial/how-to-use-oled-display-with-microbit,"['Microbit', 'OLED', 'Display', 'Temperature', 'Humidity', 'Sensor', 'DIY', 'STEM', 'Electronics', 'Project', 'micro:bit']","[{'name': 'REKA:BIT (with micro:bit V2 included) - Simplifying Robotics with micro:bit', 'price': '142', 'quantity': '1'}, {'name': 'Grove - SSD1315 OLED Display 0.96 inch (Yellow&Blue)', 'price': 'N/A', 'quantity': '1'}]",
515,Creative Ways to Use Leftover 3D Printer Filament,RE-EDIT,FALSE,FALSE,FALSE,FALSE,FALSE,FALSE,Edit Thumbnail,,Creative uses for leftover filament.,2023-02-28,education,4598,0,Abdulrahman Alhamed,Protip,Beginner,"MY, SG",3DP,TRUE,https://my.cytron.io/tutorial/useful-3d-print-ideas-for-the-end-of-the-spool,"['3DPrinting', 'FilamentReuse', 'DIY', 'Maker', 'Upcycling', 'PrintTips', '3D Modelling']","[{'name': 'SUNLU FilaDryer S1 Plus - 3D Printer Filament Dryer Box', 'price': 'N/A', 'quantity': '1'}]",
516,"Raspberry Pi 4 Model B vs Nvidia Jetson, which one is better?",RE-EDIT,FALSE,FALSE,FALSE,FALSE,FALSE,FALSE,Edit Thumbnail,,Comparison of Pi 4B vs Nvidia Jetson.,2023-03-01,education,14977,2,Yo Nutchanon,Protip,Not a project,"MY, SG, TH, WWW","Raspberry Pi, NVIDIA",TRUE,https://my.cytron.io/tutorial/pi4b-vs-jetson,"['Raspberry Pi', 'Nvidia Jetson', 'SBC', 'Single Board Computer', 'RaspberryPi', 'JetsonNano', 'AI', 'EdgeComputing', 'SBC', 'IoT', 'Robotics', 'MachineLearning', 'DIY', 'MakerProjects', 'Raspberry Pi', 'NVidia AI']","[{'name': 'NVIDIA Jetson Nano Developer Kit Rev.B01', 'price': 'N/A', 'quantity': '1'}, {'name': 'reComputer Jetson Nano 4G Dev Kit', 'price': 'N/A', 'quantity': '1'}, {'name': 'reComputer Jetson Nano 4G Advanced Dev Kit', 'price': '1399', 'quantity': '1'}, {'name': 'Alternative NVidia Jetson NANO 4GB B01 Dev Kit with Official Module', 'price': '1280', 'quantity': '1'}]",
517,How To Control LED with Blynk Using Maker Feather AIOT S3,RE-EDIT,FALSE,FALSE,FALSE,FALSE,FALSE,FALSE,Edit Thumbnail,,IoT LED project with ESP32-S3 Feather.,2023-03-06,education,932,0,Hussien,Tutorial,Beginner,"MY, SG, WWW",IoT/ESP32,TRUE,https://my.cytron.io/tutorial/how-to-control-led-with-blynk-using-maker-feather-aiot-s3,"['ESP32', 'Wireless & IoT']","[{'name': 'Adafruit Sensirion SHT40 Temperature & Humidity Sensor - STEMMA QT / Qwiic', 'price': 'N/A', 'quantity': '1'}, {'name': 'Maker Feather AIoT S3: Simplifying AIoT with ESP32', 'price': '79', 'quantity': '1'}]",
518,Temperature And Humidity Data From SHT40 To Thingspeak With Maker Feather AIOT S3,RE-EDIT,FALSE,FALSE,FALSE,FALSE,FALSE,FALSE,Edit Thumbnail,,Send sensor data to ThingSpeak.,2023-03-06,education,754,0,Hussien,Tutorial,Beginner,"MY, WWW",IoT/ESP32,TRUE,https://my.cytron.io/tutorial/temperature-and-humidity-data-from-sht40-to-thingspeak-with-maker-feather-aiot-s3,,"[{'name': 'Adafruit Sensirion SHT40 Temperature & Humidity Sensor - STEMMA QT / Qwiic', 'price': 'N/A', 'quantity': '1'}, {'name': 'Maker Feather AIoT S3: Simplifying AIoT with ESP32', 'price': '79', 'quantity': '1'}]",
519,Why Does PLA Filament Get Brittle: Causes and Solutions,RE-EDIT,FALSE,FALSE,FALSE,FALSE,FALSE,FALSE,Edit Thumbnail,,Causes and fixes for brittle PLA.,2023-03-07,education,14852,1,Abdulrahman Alhamed,Protip,Beginner,"MY, SG, WWW",3DP,TRUE,https://my.cytron.io/tutorial/why-does-pla-filament-get-brittle,"['PLA', '3DPrinting', 'Filament', 'Materials', 'Troubleshooting', 'DIY', 'Maker', 'PrintingTips', 'Guide', 'Solutions', '3D Modelling']","[{'name': 'SUNLU FilaDryer S1 Plus - 3D Printer Filament Dryer Box', 'price': 'N/A', 'quantity': '1'}, {'name': 'SUNLU FilaDryer S2 - 3D Printer Filament Dryer Box', 'price': 'N/A', 'quantity': '1'}, {'name': 'Creality Ender-PLA 1.75mm 3D Printing Filament 1kg', 'price': '59', 'quantity': '1'}]",
520,IoT Based Home Security Security System,RE-EDIT,FALSE,FALSE,FALSE,FALSE,FALSE,FALSE,Edit Thumbnail,,Smart IoT-based home security.,2023-03-07,education,1417,0,Abdulrahman Alhamed,Tutorial,Beginner,"MY, SG, WWW",IoT/ESP32,TRUE,https://my.cytron.io/tutorial/iot-based-home-security-security-system,"['IoT', 'Wireless & IoT']","[{'name': 'Maker Feather AIoT S3 (Complete Kit)', 'price': '145', 'quantity': '1'}]",
521,Popular Industrial use cases for Raspberry Pi Computers,UPDATED,TRUE,TRUE,TRUE,TRUE,FALSE,FALSE,,,Overview of industry Pi applications.,2023-03-07,industry,7287,3,engtong,Protip,Not a project,"MY, SG, TH, WWW",Raspberry Pi,TRUE,https://my.cytron.io/tutorial/popular-industrial-use-cases-for-raspberry-pi-computers,"['RaspberryPi', 'Industrial', 'Automation', 'IoT', 'EdgeComputing', 'AI', 'Maker', 'SBC', 'Tech', 'DIY', 'Raspberry Pi', 'Wireless & IoT']","[{'name': 'EdgeBox RPi 200 - Industrial Edge Controller with CM4', 'price': '1299', 'quantity': '1'}, {'name': 'EdgeLogix RPi 1000 Industrial Controller WiFi CM4 8GB RAM 32GB eMMC', 'price': '2525', 'quantity': '1'}, {'name': 'IRIV PiControl - IR4.0 Industrial Controller', 'price': '1345', 'quantity': '1'}]",
522,Getting Started with CM4 Maker Board,MAINTAIN,FALSE,FALSE,FALSE,FALSE,FALSE,FALSE,Edit Thumbnail,,Beginner guide for CM4 Maker Board.,2023-03-08,education,8451,1,Abdul Salam,Tutorial,Beginner,"MY, SG, WWW",Raspberry Pi,TRUE,https://my.cytron.io/tutorial/getting-started-with-cm4-maker-board,"['CM4 Maker Board', 'Raspberry Pi CM4', 'Raspberry Pi OS', 'boot setup', 'microSD', 'SSD', 'eMMC', 'installation guide', 'Raspberry Pi', 'embedded systems', 'Raspberry Pi']","[{'name': 'RPi Compute Module 4 with Wireless 4GB RAM Lite', 'price': '264', 'quantity': '1'}, {'name': 'MakerDisk Class 10 A2 microSD 32GB-Preloaded Raspberry Pi OS', 'price': '44', 'quantity': '1'}, {'name': 'NVMe 2242 B+M-Key MakerDisk SSD - 128GB (with Raspberry Pi OS)', 'price': '129', 'quantity': '1'}, {'name': 'CM4 Maker Board & Kits : Maker’s Carrier Board for Raspberry Pi CM4/CM5', 'price': '224', 'quantity': '1'}]",
523,Boot up Raspberry Pi CM4 on CM4 Maker Board,MAINTAIN,FALSE,FALSE,FALSE,FALSE,FALSE,FALSE,Edit Thumbnail,,Booting tutorial for CM4 Maker Board.,2023-03-08,education,2844,0,Abdul Salam,Tutorial,Beginner,"MY, SG, TH, WWW",Raspberry Pi,TRUE,,,,
524,"Lesson 1 : GPIO, Grove port & Maker port",MAINTAIN,FALSE,FALSE,FALSE,FALSE,FALSE,FALSE,Edit Thumbnail,,GPIO basics on Maker Board.,2023-03-09,education,1170,0,Abdul Salam,Tutorial,Beginner,"MY, SG, TH, WWW",Raspberry Pi,TRUE,https://my.cytron.io/tutorial/lesson-1-gpio-grove-port-maker-port,,,
525,Lesson 2 : Buzzer & Buttons,MAINTAIN,FALSE,FALSE,FALSE,FALSE,FALSE,FALSE,Edit Thumbnail,,Learn buzzer and button basics.,2023-03-09,education,730,0,Abdul Salam,Tutorial,Beginner,"MY, SG, TH, WWW",Raspberry Pi,TRUE,,,,
526,Lesson 3 : Camera,MAINTAIN,FALSE,FALSE,FALSE,FALSE,FALSE,FALSE,Edit Thumbnail,,Learn to use camera module.,2023-03-09,education,1475,0,Abdul Salam,Tutorial,Beginner,"MY, SG, TH, WWW",Raspberry Pi,TRUE,,,,
527,Lesson 4 : Setup switch ON/OFF button,MAINTAIN,FALSE,FALSE,FALSE,FALSE,FALSE,FALSE,Edit Thumbnail,,Setup ON/OFF button.,2023-03-09,education,1244,0,Abdul Salam,Tutorial,Beginner,"MY, SG, TH, WWW",Raspberry Pi,TRUE,,,,
528,Lesson 5 : RTC,MAINTAIN,FALSE,FALSE,FALSE,FALSE,FALSE,FALSE,Edit Thumbnail,,Using RTC with Maker board.,2023-03-09,education,1149,0,Abdul Salam,Tutorial,Beginner,"MY, SG, TH, WWW",Raspberry Pi,TRUE,,,,
529,Lesson 6 : Audio Jack,MAINTAIN,FALSE,FALSE,FALSE,FALSE,FALSE,FALSE,Edit Thumbnail,,Play audio on Maker board.,2023-03-09,education,929,0,Abdul Salam,Tutorial,Beginner,"MY, SG, TH, WWW",Raspberry Pi,TRUE,,,,
530,Sending Blynk Messages to An LCD with micro:bit,RE-EDIT,FALSE,FALSE,FALSE,FALSE,FALSE,FALSE,Edit Thumbnail,,Display IoT messages on LCD.,2023-03-10,education,3572,1,Abdulrahman Alhamed,Tutorial,Beginner,"MY, SG, TH, VN, WWW",micro:bit,TRUE,https://my.cytron.io/tutorial/sending-blynk-messages-to-an-lcd-with-microbit,"['IoT', 'micro:bit', 'Blynk', 'micro:bit', 'Wireless & IoT']","[{'name': 'REKA:BIT (with micro:bit V2 included) - Simplifying Robotics with micro:bit', 'price': '142', 'quantity': '1'}, {'name': 'Grove WiFi 8266 - IoT for micro:bit and beyond', 'price': '26', 'quantity': '1'}]",
531,How Raspberry Pi Are Helping The Industries?,UPDATED,TRUE,TRUE,TRUE,TRUE,FALSE,FALSE,,,Industrial benefits of Pi.,2023-03-14,industry,1136,0,Hussien,Protip,Not a project,"MY, SG, TH, VN, WWW",Raspberry Pi,TRUE,https://my.cytron.io/tutorial/how-raspberry-pi-are-helping-the-industries,"['Raspberry Pi', 'industrial']","[{'name': 'IRIV PiControl - IR4.0 Industrial Controller', 'price': '1345', 'quantity': '1'}]",
532,Challenges in Using Pi 4 in Industrial Projects And The Solution,UPDATED,TRUE,TRUE,TRUE,TRUE,FALSE,FALSE,,,Challenges when deploying Pi in industry.,2023-03-14,industry,3121,0,engtong,Protip,Not a project,"MY, SG, TH, WWW",Raspberry Pi,TRUE,https://my.cytron.io/tutorial/challenges-in-using-pi-4-in-industrial-projects-and-the-solution,"['raspberry pi', 'CM4', 'industrial', 'Raspberry Pi']","[{'name': 'EdgeBox RPi 200 - Industrial Edge Controller with CM4', 'price': '1299', 'quantity': '1'}, {'name': 'EdgeLogix RPi 1000 Industrial Controller WiFi CM4 8GB RAM 32GB eMMC', 'price': '2525', 'quantity': '1'}, {'name': 'CM4 Maker Board & Kits : Maker’s Carrier Board for Raspberry Pi CM4/CM5', 'price': '224', 'quantity': '1'}]",
533,Prevent and Fix Warping Issues in 3D Printing,RE-EDIT,FALSE,FALSE,FALSE,FALSE,FALSE,FALSE,Edit Thumbnail,,Solve warping issues.,2023-03-16,education,1679,0,Abdulrahman Alhamed,Tutorial,Beginner,"MY, SG, WWW",3DP,TRUE,https://my.cytron.io/tutorial/prevent-and-fix-warping-issues-in-3d-printing,"['3DPrinting', '3D Modelling']","[{'name': '3D Printer Build Plate Adhesive Spray - Prevent Warping', 'price': '28', 'quantity': '1'}]",
534,IoT-Based Smart Farming: Remote Monitoring for Agriculture,RE-EDIT,FALSE,FALSE,FALSE,FALSE,FALSE,FALSE,Edit Thumbnail,,Remote monitoring for agriculture.,2023-03-18,education,2944,0,Abdulrahman Alhamed,Tutorial,Beginner,"MY, SG, WWW",IoT/ESP32,TRUE,https://my.cytron.io/tutorial/using-iot-to-monitor-your-agriculture,"['IoT', 'Agriculture', 'SmartFarming', 'SoilMoisture', 'Sensors', 'Automation', 'RaspberryPi', 'DIY', 'STEM', 'Electronics', 'Wireless & IoT']","[{'name': 'Maker Feather AIoT S3 (Complete Kit)', 'price': '145', 'quantity': '1'}]",
535,Everything You Need to Know About 3D Printing Pens,RE-EDIT,FALSE,FALSE,FALSE,FALSE,FALSE,FALSE,Edit Thumbnail,,Intro to 3D printing pens.,2023-03-21,education,3683,0,Abdulrahman Alhamed,Protip,Beginner,"MY, SG, TH, WWW",3DP,TRUE,https://my.cytron.io/tutorial/everything-you-need-to-know-about-3d-printing-pens,"['3DPrinting', 'Pens', '3D Modelling']","[{'name': '12V 3D Pen V2 with PLA Filament & Adapter - Blue', 'price': '46', 'quantity': '1'}, {'name': '5V 3D Pen V2 with PLA Filament', 'price': '34', 'quantity': '1'}]",
