256,Can you connect the HAT directly to Raspberry Pi 400?,RE-EDIT,FALSE,FALSE,FALSE,FALSE,FALSE,FALSE,Edit Thumbnail,,Guide on compatibility of HATs with Pi 400.,2020-11-04,education,1570,0,Idris,Tutorial,Beginner,"MY, SG, WWW",Raspberry Pi 400,TRUE,https://my.cytron.io/tutorial/can-you-connect-the-hat-directly-to-raspberry-pi-400,"['Raspberry Pi', 'rpi400', 'Personal Computer', 'Keyboard Computer', 'Raspberry Pi']","[{'name': 'Raspberry Pi 400 Computer Kit-UK Layout and UK Power Plug', 'price': '422', 'quantity': '1'}, {'name': 'Raspberry Pi 400 Computer Kit-US Layout and US Power Plug', 'price': '422', 'quantity': '1'}, {'name': 'Raspberry Pi 400 Starter Kit - US Layout & Universal Plug', 'price': '457', 'quantity': '1'}]",
257,Is it possible to upload files directly to Google Cloud?,RE-EDIT,FALSE,FALSE,FALSE,FALSE,FALSE,FALSE,Edit Thumbnail,,Guide to upload files from Pi directly to Google Drive.,2020-11-04,education,1508,0,suadanwar,Protip,Beginner,"MY, SG, TH, VN, WWW",Raspberry Pi,TRUE,https://my.cytron.io/tutorial/is-it-possible-to-upload-files-directly-to-google-cloud,"['Wireless & IoT', 'News']",,
258,OpenCV Template Matching on Raspberry Pi 400,RE-EDIT,FALSE,FALSE,FALSE,FALSE,FALSE,FALSE,Edit Thumbnail,,Using template matching for image recognition with OpenCV.,2020-11-06,education,1645,0,suadanwar,Tutorial,Beginner,"MY, SG, TH, VN, WWW",Raspberry Pi 400,TRUE,https://my.cytron.io/tutorial/opencv-template-matching-on-raspberry-pi-400,"['Raspberry Pi', 'Pi Camera', 'Raspberry Pi']",,
259,Turned Your Tablet as a Display for the Raspberry Pi 400,RE-EDIT,FALSE,FALSE,FALSE,FALSE,FALSE,FALSE,Edit Thumbnail,,Turn a tablet into an external Pi display.,2020-11-11,education,1572,0,Idris,Tutorial,Intermediate,"MY, SG, WWW",Raspberry Pi 400,TRUE,https://my.cytron.io/tutorial/turned-your-tablet-as-a-display-for-the-raspberry-pi-400,"['Raspberry Pi 400', 'Personal Computer', 'Keyboard Computer', 'Raspberry Pi']","[{'name': 'Raspberry Pi 400 Computer Kit-UK Layout and UK Power Plug', 'price': '422', 'quantity': '1'}, {'name': 'Raspberry Pi 400 Computer Kit-US Layout and US Power Plug', 'price': '422', 'quantity': '1'}, {'name': 'Raspberry Pi 400 Starter Kit - US Layout & Universal Plug', 'price': '457', 'quantity': '1'}]",
260,Face Recognition Using OpenCV on Raspberry Pi 400,RE-EDIT,FALSE,FALSE,FALSE,FALSE,FALSE,FALSE,Edit Thumbnail,,Build a Pi 400 face recognition project using OpenCV.,2020-11-13,education,5280,0,suadanwar,Tutorial,Beginner,"MY, SG, WWW",Raspberry Pi 400,TRUE,https://my.cytron.io/tutorial/face-recognition-using-opencv-on-raspberry-pi-400,"['RaspberryPi400', 'OpenCV', 'FaceRecognition', 'AI', 'ComputerVision', 'Python', 'MachineLearning', 'DIY', 'EmbeddedSystems', 'Maker', 'Raspberry Pi']","[{'name': 'Raspberry Pi 15W (5V/3A) PSU USB-C UK Plug-Black', 'price': '39', 'quantity': '1'}, {'name': 'Raspberry Pi 400 Keyboard Computer and Kits', 'price': '316', 'quantity': '1'}]",
262,Simple Alarm System Using Maker Nano,RE-EDIT,FALSE,FALSE,FALSE,FALSE,FALSE,FALSE,Edit Thumbnail,,DIY alarm using magnetic contact switch.,2020-11-20,education,2601,0,suadanwar,Tutorial,Beginner,"MY, SG, TH, VN, WWW",Arduino,TRUE,https://my.cytron.io/tutorial/simple-alarm-system-using-maker-nano,"['Arduino Ecosystem', 'Sensor', 'Makers']",,
263,Send Data to Firebase Using Arduino Uno WiFi Rev2,RE-EDIT,FALSE,FALSE,FALSE,FALSE,FALSE,FALSE,Edit Thumbnail,,IoT data logging using Firebase + Arduino Uno WiFi.,2020-11-25,education,3398,0,Idris,Tutorial,Beginner,"MY, SG, WWW","Arduino, IoT/ESP32",TRUE,https://my.cytron.io/tutorial/send-data-to-firebase-using-arduino-uno-wifi-rev2,"['Arduino Uno WiFi Rev2', 'Firebase', 'IoT', 'data logging', 'real-time database', 'WiFi communication', 'Arduino Cloud', 'ESP8266', 'HTTP requests', 'IoT projects', 'Arduino Ecosystem', 'Wireless & IoT']","[{'name': 'USB B Type Cable', 'price': '3', 'quantity': '1'}, {'name': 'Arduino UNO WiFi Rev2.0 Dev Board', 'price': '279', 'quantity': '1'}]",
264,Face Recognition Door Lock System Using OpenCV on Raspberry Pi,RE-EDIT,FALSE,FALSE,FALSE,FALSE,FALSE,FALSE,Edit Thumbnail,,Pi-based security system with face recognition unlock.,2020-11-26,education,7485,0,suadanwar,Tutorial,Beginner,"MY, SG, TH, VN, WWW",Raspberry Pi,TRUE,https://my.cytron.io/tutorial/face-recognition-door-lock-system-using-opencv-on-raspberry-pi,"['Raspberry Pi', 'Raspberry Pi']",,
265,Why Raspberry Pi is the future of computing devices?,UPDATED,TRUE,TRUE,TRUE,TRUE,FALSE,FALSE,,,Blog post on Pi’s importance in computing.,2020-11-27,industry,1787,0,suadanwar,News,Not a project,"MY, SG, TH, VN, WWW",Raspberry Pi,TRUE,https://my.cytron.io/tutorial/why-raspberry-pi-is-the-future-of-computing-devices,"['Raspberry Pi', 'News']",,
266,Case Fan That Keeps Raspberry Pi 4 Model B Cool,RE-EDIT,FALSE,FALSE,FALSE,FALSE,FALSE,FALSE,Edit Thumbnail,,Keep Pi cool with case fan.,2020-12-01,education,2206,0,Ober,Protip,Beginner,"MY, SG, TH, VN, WWW",Raspberry Pi,TRUE,https://my.cytron.io/tutorial/case-fan-that-keeps-raspberry-pi-4-model-b-cool,"['stressberry', 'thermal', 'RPI4B', 'Official Case', 'RPI4', 'Raspberry Pi']",,
267,Remote SSH Raspberry Pi Using Visual Studio Code,RE-EDIT,FALSE,FALSE,FALSE,FALSE,FALSE,FALSE,Edit Thumbnail,,Setup Visual Studio Code remote access to Pi.,2020-12-02,education,2608,0,Idris,Tutorial,Beginner,"MY, SG, TH, VN, WWW",Raspberry Pi,TRUE,https://my.cytron.io/tutorial/remote-ssh-raspberry-pi-using-visual-studio-code,"['Raspberry Pi', 'Remote SSH', 'Visual Studio Code', 'Raspberry Pi']",,
268,Control and Monitor Your 3d Printer Using OctoPrint On Raspberry Pi,RE-EDIT,FALSE,TRUE,FALSE,FALSE,FALSE,FALSE,,,Full OctoPrint workflow to control 3D printers.,2020-12-04,education,1328,0,suadanwar,Tutorial,Intermediate,"MY, SG","Raspberry Pi, 3DP",TRUE,https://my.cytron.io/tutorial/control-and-monitor-your-3d-printer-using-octoprint-on-raspberry-pi,"['Raspberry Pi', '3D print', 'Raspberry Pi', '3D Modelling']","[{'name': 'Creality Ender-3 V3 KE 3D Printer + 1KG PLA', 'price': '1497', 'quantity': '1'}]",
269,Send Data to Firebase Using Raspberry Pi 4,RE-EDIT,FALSE,FALSE,FALSE,FALSE,FALSE,FALSE,Edit Thumbnail,,IoT Firebase integration on Raspberry Pi.,2020-12-09,education,5473,1,Idris,Tutorial,Intermediate,"MY, SG, WWW",Raspberry Pi,TRUE,https://my.cytron.io/tutorial/send-data-to-firebase-using-raspberry-pi,"['Raspberry Pi', 'MLX90614', 'Firebase', 'RaspberryPi', 'Firebase', 'IoT', 'RealtimeDatabase', 'Cloud', 'Python', 'DataLogging', 'Maker', 'DIY', 'EmbeddedSystems', 'Raspberry Pi', 'Wireless & IoT']","[{'name': 'Maker pHAT: Simplifying Raspberry Pi for {Education}', 'price': '43', 'quantity': '1'}, {'name': 'Raspberry Pi 4 Model B - 2GB', 'price': '208', 'quantity': '1'}, {'name': 'Raspberry Pi 15W (5V/3A) PSU USB-C UK Plug-Black', 'price': '39', 'quantity': '1'}, {'name': 'MLX90614 Non-Contact Infrared Temperature Sensor', 'price': '49', 'quantity': '1'}]",
270,Interfacing e-Paper Display Using Raspberry Pi,DISABLE,FALSE,FALSE,FALSE,FALSE,FALSE,FALSE,Edit Thumbnail,,Show data on e-paper display via Raspberry Pi.,2020-12-22,education,2416,0,Idris,Tutorial,Beginner,"MY, SG, TH, VN, WWW",Raspberry Pi,TRUE,https://my.cytron.io/tutorial/interfacing-e-paper-display-using-raspberry-pi,"['Raspberry Pi', 'CircuitPython', 'e-Paper', 'e-Ink', 'Raspberry Pi', 'Python for MCU']",,
271,Simple and Easy LED Card,RE-EDIT,FALSE,FALSE,FALSE,FALSE,FALSE,FALSE,Edit Thumbnail,,DIY LED Christmas/New Year card.,2020-12-25,education,1890,0,suadanwar,Tutorial,Beginner,"MY, SG, TH, VN, WWW",Electronic,TRUE,https://my.cytron.io/tutorial/simple-and-easy-led-card,"['Card', 'DIY']",,
272,Raspberry Pi Zero USB Webcam,RE-EDIT,FALSE,FALSE,FALSE,FALSE,FALSE,FALSE,Edit Thumbnail,,Use Pi Zero as plug-and-play USB webcam.,2020-12-29,education,3704,0,tkhao96,Project,Intermediate,"MY, SG, TH, VN, WWW",Raspberry Pi,TRUE,https://my.cytron.io/tutorial/raspberry-pi-zero-usb-webcam,"['pi zero', 'USB Webcam', 'Webcam', 'Raspberry Pi']",,
273,Weather Display on e-Paper Using Raspberry Pi,DISABLE,FALSE,FALSE,FALSE,FALSE,FALSE,FALSE,Edit Thumbnail,,Display online weather data on e-paper with Pi.,2020-12-30,education,1463,0,Idris,Tutorial,Beginner,"MY, SG, TH, VN, WWW",Raspberry Pi,TRUE,https://my.cytron.io/tutorial/weather-display-on-e-paper-using-raspberry-pi,"['Raspberry Pi', 'Raspberry Pi']",,
274,Getting Started With Node-RED Using Raspberry Pi,RE-EDIT,FALSE,FALSE,FALSE,FALSE,FALSE,FALSE,Edit Thumbnail,,Beginner IoT flow programming with Node-RED.,2021-01-05,education,1757,1,Idris,Tutorial,Beginner,"MY, SG, TH, VN, WWW",Raspberry Pi,TRUE,https://my.cytron.io/tutorial/getting-started-with-node-red-using-raspberry-pi,"['Getting Started', 'Raspberry Pi', 'Node-RED', 'Raspberry Pi']",,
275,How Raspberry Pi Has Changed the World,RE-EDIT,FALSE,FALSE,FALSE,FALSE,FALSE,FALSE,Edit Thumbnail,,Article on Pi’s global impact.,2021-01-05,education,1700,0,suadanwar,News,Not a project,"MY, SG, TH, VN, WWW",Raspberry Pi,TRUE,https://my.cytron.io/tutorial/how-raspberry-pi-has-changed-the-world,"['Raspberry Pi', 'News']",,
276,The Octolapse V0.4.1 With Raspberry Pi Camera,RE-EDIT,FALSE,FALSE,FALSE,FALSE,FALSE,FALSE,Edit Thumbnail,,Setup Octolapse plugin for time-lapse 3D printing.,2021-01-08,education,1272,0,suadanwar,Tutorial,Beginner,"MY, SG","Raspberry Pi, 3DP",TRUE,https://my.cytron.io/tutorial/the-octolapse-v0-4-1-with-raspberry-pi-camera,"['Raspberry Pi', '3D print', 'Raspberry Pi', '3D Modelling']","[{'name': 'Creality Ender-3 V3 KE 3D Printer + 1KG PLA', 'price': '1497', 'quantity': '1'}]",
277,Basic Comparison Between MicroPython and Arduino,RE-EDIT,FALSE,FALSE,FALSE,FALSE,FALSE,FALSE,Edit Thumbnail,,Compare MicroPython and Arduino C/C++.,2021-01-12,education,2561,0,Idris,Protip,Beginner,"MY, SG, TH, VN, WWW","Arduino, CircuiPython",TRUE,https://my.cytron.io/tutorial/basic-comparison-between-micropython-and-arduino,"['Arduino', 'MicroPython', 'Python for MicroController', 'Arduino Ecosystem', 'Python for MCU']",,
278,Program micro:bit V2 Using MicroPython On Raspberry Pi,RE-EDIT,FALSE,FALSE,FALSE,FALSE,FALSE,FALSE,Edit Thumbnail,,Learn MicroPython with micro:bit v2 on Pi.,2021-01-15,education,1529,0,suadanwar,Tutorial,Beginner,"MY, SG, TH, VN, WWW","Raspberry Pi, micro:bit",TRUE,https://my.cytron.io/tutorial/program-microbit-v2-using-micropython-on-raspberry-pi,"['Arduino Ecosystem', 'Wireless & IoT']",,
279,Learn Microcontroller Code Easier With MicroPython REPL,RE-EDIT,FALSE,FALSE,FALSE,FALSE,FALSE,FALSE,Edit Thumbnail,,Beginner guide to MicroPython.,2021-01-19,education,2928,0,Idris,Tutorial,Beginner,"MY, SG, TH, VN, WWW",IoT/ESP32,TRUE,https://my.cytron.io/tutorial/learn-microcontroller-code-easier-with-micropython-repl,"['MicroPython', 'Python for MicroController', 'REPL', 'ESP32', 'Python for MCU']",,
280,A New Challenger in MCU Platform - Raspberry Pi Pico,RE-EDIT,FALSE,FALSE,FALSE,FALSE,FALSE,FALSE,Edit Thumbnail,,Intro to Raspberry Pi Pico board.,2021-01-21,education,3229,0,Ober,Protip,Beginner,"MY, SG, TH, VN, WWW",RPI Pico,TRUE,https://my.cytron.io/tutorial/a-new-challenger-in-mcu-platform-raspberry-pi-pico,"['Microcontroller', 'Raspberry Pi']",,
281,Raspberry Pi Pico VS Arduino UNO,RE-EDIT,FALSE,TRUE,FALSE,FALSE,FALSE,FALSE,,,Compare Pi Pico vs Arduino UNO.,2021-01-21,education,3810,0,suadanwar,Protip,Not a project,"MY, SG, TH, WWW","RPI Pico, Arduino",TRUE,https://my.cytron.io/tutorial/raspberry-pico-vs-arduino-uno,"['RaspberryPiPico', 'ArduinoUNO', 'Microcontroller', 'Electronics', 'DIY', 'Maker', 'EmbeddedSystems', 'Coding', 'Hardware', 'Comparison', 'Arduino Ecosystem', 'Raspberry Pi', 'News']","[{'name': 'Arduino Uno Rev3 (Original Italy)', 'price': '138', 'quantity': '1'}, {'name': 'Maker UNO: Simplifying Arduino for {Education}', 'price': '36', 'quantity': '1'}, {'name': 'Raspberry Pi Pico Microcontroller Board', 'price': '19', 'quantity': '1'}]",
282,Raspberry Pi Pico VS Arduino MKRZero,RE-EDIT,FALSE,TRUE,FALSE,FALSE,FALSE,FALSE,,,Comparison between Pico and MKRZero.,2021-01-21,education,2002,0,suadanwar,Protip,Beginner,"MY, SG, TH, VN, WWW","RPI Pico, Arduino",TRUE,https://my.cytron.io/tutorial/raspberry-pi-pico-vs-arduino-mkrzero,"['Pico', 'Arduino vs Pico', 'Arduino Ecosystem', 'Raspberry Pi', 'News']",,
283,Raspberry Pi Pico VS Teensy LC,RE-EDIT,FALSE,TRUE,FALSE,FALSE,FALSE,FALSE,,,Compare Pico vs Teensy LC board.,2021-01-21,education,5945,0,suadanwar,Protip,Beginner,"MY, SG, TH, WWW","RPI Pico, IoT/ESP32",TRUE,https://my.cytron.io/tutorial/raspberry-pi-pico-vs-teensy-lc,"['RaspberryPiPico', 'TeensyLC', 'Microcontrollers', 'EmbeddedSystems', 'DIY', 'Maker', 'Electronics', 'Arduino', 'IoT', 'HardwareComparison', 'Raspberry Pi', 'Teensy', 'News']","[{'name': 'Raspberry Pi Pico Microcontroller Board', 'price': '19', 'quantity': '1'}, {'name': 'Teensy 4.1 Controller Board', 'price': '159', 'quantity': '1'}, {'name': 'Raspberry Pi Pico 2 Microcontroller Board', 'price': '24', 'quantity': '1'}]",
284,Raspberry Pi Pico vs. micro:bit V2 – Which One Should You Choose?,RE-EDIT,FALSE,TRUE,FALSE,FALSE,FALSE,FALSE,,,Compare Pico and micro:bit V2.,2021-01-21,education,3756,0,suadanwar,Protip,Not a project,"MY, SG, WWW","RPI Pico, micro:bit",TRUE,https://my.cytron.io/tutorial/raspberry-pico-vs-microbit,"['RaspberryPiPico', 'microbitV2', 'Microcontroller', 'STEM', 'IoT', 'EmbeddedSystems', 'DIYElectronics', 'Maker', 'CodingForKids', 'Robotics', 'Raspberry Pi', 'micro:bit', 'News']","[{'name': 'Raspberry Pi Pico Microcontroller Board', 'price': '19', 'quantity': '1'}, {'name': 'BBC micro:bit V2 Official Bundles', 'price': '85', 'quantity': '1'}]",
285,Making A Lucky Draw Device Using Raspberry Pi Pico,RE-EDIT,FALSE,FALSE,FALSE,FALSE,FALSE,FALSE,Edit Thumbnail,,Pico project for random lucky draw machine.,2021-01-27,education,2250,0,Idris,Tutorial,Beginner,"MY, SG, TH, VN, WWW",RPI Pico,TRUE,https://my.cytron.io/tutorial/making-a-lucky-draw-device-using-raspberry-pi-pico,"['Raspberry Pi', 'MicroPython', 'Raspberry Pi Pico', 'Raspberry Pi', 'Python for MCU']",,
286,Physical Computing with Raspberry Pi Pico,RE-EDIT,FALSE,FALSE,FALSE,FALSE,FALSE,FALSE,Edit Thumbnail,,Learn GPIO & physical computing with Pico.,2021-02-01,education,1110,0,suadanwar,Tutorial,Beginner,"MY, SG, TH, VN, WWW",RPI Pico,TRUE,https://my.cytron.io/tutorial/physical-computing-with-raspberry-pi-pico,"['Raspberry Pi', 'Pico', 'Raspberry Pi']",,
287,Write Read Data to SD Card Using Maker Pi Pico and CircuitPython,RE-EDIT,FALSE,FALSE,FALSE,FALSE,FALSE,FALSE,Edit Thumbnail,,Read/write data with SD card using Pico.,2021-02-02,education,4378,0,Idris,Tutorial,Intermediate,"MY, SG, TH, VN, WWW",RPI Pico,TRUE,https://my.cytron.io/tutorial/write-read-data-to-sd-card-using-maker-pi-pico-and-circuitpython,"['Maker Pi Pico', 'CircuitPython', 'SD card', 'data logging', 'Raspberry Pi Pico', 'microSD', 'SPI communication', 'file handling', 'embedded systems', 'Python coding', 'Raspberry Pi', 'Python for MCU']","[{'name': 'USB Micro B Cable', 'price': '4', 'quantity': '1'}, {'name': 'Maker Pi Pico: Simplifying Raspberry Pi Pico for Beginners', 'price': '48', 'quantity': '1'}, {'name': 'Raspberry Pi Approved MakerDisk microSD Card with RPi OS', 'price': '44', 'quantity': '1'}]",
288,Build a Light Theremin Using Maker Pi Pico and CircuitPython,RE-EDIT,FALSE,FALSE,FALSE,FALSE,FALSE,FALSE,Edit Thumbnail,,Fun music project using light sensors with Pico.,2021-02-10,education,2134,0,Idris,Tutorial,Beginner,"MY, SG, TH, VN, WWW",RPI Pico,TRUE,https://my.cytron.io/tutorial/build-a-light-theremin-using-maker-pi-pico-and-circuitpython,"['CircuitPython', 'Raspberry Pi Pico', 'Light Theremin', 'Raspberry Pi', 'Python for MCU']",,
289,Burglar Alarm Using Raspberry Pi Pico,RE-EDIT,FALSE,FALSE,FALSE,FALSE,FALSE,FALSE,Edit Thumbnail,,DIY alarm system with Pico + PIR sensor.,2021-02-12,education,1386,0,suadanwar,Tutorial,Beginner,"MY, SG, TH, VN, WWW",RPI Pico,TRUE,https://my.cytron.io/tutorial/burglar-alarm-using-raspberry-pi-pico,"['Raspberry Pi', 'Pico', 'Raspberry Pi']",,
290,Keyboard Emulator Using Raspberry Pi Pico (Maker Pi Pico) and CircuitPython,RE-EDIT,FALSE,FALSE,FALSE,FALSE,FALSE,FALSE,Edit Thumbnail,,Emulate USB keyboard with Raspberry Pi Pico.,2021-02-16,education,7195,0,Idris,Tutorial,Beginner,"MY, SG, WWW",RPI Pico,TRUE,https://my.cytron.io/tutorial/keyboard-emulator-using-raspberry-pi-pico-maker-pi-pico-and-circuitpython,"['RaspberryPiPico', 'CircuitPython', 'KeyboardEmulator', 'HID', 'USB', 'Maker', 'DIY', 'Automation', 'IoT', 'Microcontroller', 'Raspberry Pi', 'Python for MCU']","[{'name': 'Maker Pi Pico & Kits: Simplifying Raspberry Pi Pico for Beginner', 'price': '36', 'quantity': '1'}, {'name': 'Raspberry Pi 400 Keyboard Computer and Kits', 'price': '316', 'quantity': '1'}]",
291,Overclock Raspberry Pi 4 Model B to 2.0GHz for Raspberry Pi OS,RE-EDIT,FALSE,FALSE,FALSE,FALSE,FALSE,FALSE,Edit Thumbnail,,Overclock tutorial for Raspberry Pi 4B.,2021-02-18,education,2483,0,haikal,Protip,Intermediate,"MY, SG, TH, VN, WWW",Raspberry Pi,TRUE,https://my.cytron.io/tutorial/overclock-raspberry-pi-4-model-b-to-2-0ghz,"['Raspberry Pi 4 model B', 'Overclock', 'Raspberry Pi']",,
292,Control LED Brightness Using PWM On Raspberry Pi Pico,RE-EDIT,FALSE,TRUE,FALSE,FALSE,FALSE,FALSE,,,Use PWM to adjust LED brightness on Pico.,2021-02-19,education,10969,0,suadanwar,Tutorial,Beginner,"MY, SG, TH, VN, WWW",RPI Pico,TRUE,https://my.cytron.io/tutorial/control-led-brightness-using-pwm-on-raspberry-pi-pico,"['Raspberry Pi', 'Pico', 'Raspberry Pi']",,
293,Read and Display Environment Sensor Data Using Raspberry Pi Pico and CircuitPython,RE-EDIT,FALSE,FALSE,FALSE,FALSE,FALSE,FALSE,Edit Thumbnail,,Display SHT30/BME280 sensor data on OLED.,2021-02-23,education,6508,0,Idris,Tutorial,Beginner,"MY, SG, TH, VN, WWW",RPI Pico,TRUE,https://my.cytron.io/tutorial/read-and-display-environment-sensor-data-using-raspberry-pi-pico-and-circuitpython,"['SHT30', 'CircuitPython', 'Raspberry Pi Pico', 'SSD1306', 'BMP280', 'Raspberry Pi', 'Python for MCU']",,
294,Read and Log Internal Temperature Data in Raspberry Pi Pico to .txt file.,RE-EDIT,FALSE,FALSE,FALSE,FALSE,FALSE,FALSE,Edit Thumbnail,,Use Pico’s built-in temperature sensor.,2021-02-26,education,1957,0,suadanwar,Tutorial,Beginner,"MY, SG, TH, VN, WWW",RPI Pico,TRUE,https://my.cytron.io/tutorial/read-and-log-internal-temperature-data-in-raspberry-pi-pico-to-txt-file,"['Raspberry Pi', 'Pico', 'Raspberry Pi']",,
295,Google Assistant Controlled Raspberry Pi GPIO With IFTTT and Adafruit IO,RE-EDIT,FALSE,FALSE,FALSE,FALSE,FALSE,FALSE,Edit Thumbnail,,Control relays on Pi with Google Assistant.,2021-03-03,education,1606,0,Idris,Tutorial,Intermediate,"MY, SG, TH, VN, WWW",Raspberry Pi,TRUE,https://my.cytron.io/tutorial/google-assistant-controlled-raspberry-pi-gpio-with-ifttt-and-adafruit-io,"['Raspberry Pi', 'Google Assistant', 'Adafruit IO', 'Raspberry Pi']",,
296,Overclock Raspberry Pi 400 to 2.147GHz for Raspberry Pi OS,RE-EDIT,FALSE,FALSE,FALSE,FALSE,FALSE,FALSE,Edit Thumbnail,,Push Pi 400 performance with overclocking.,2021-03-11,education,3011,0,haikal,Protip,Intermediate,"MY, SG, WWW",Raspberry Pi 400,TRUE,https://my.cytron.io/tutorial/overclock-raspberry-pi-400-to-2-147ghz-for-raspberry-pi-os,"['RaspberryPi', 'Pi400', 'Overclocking', 'Performance', 'DIY', 'Linux', 'RaspberryPiOS', 'Tweaks', 'Hardware', 'Optimization', 'Raspberry Pi']","[{'name': 'Raspberry Pi 15W (5V/3A) PSU USB-C UK Plug-White', 'price': '39', 'quantity': '1'}, {'name': 'USB microSD Card Reader and Writer', 'price': 'N/A', 'quantity': '1'}, {'name': 'Raspberry Pi 400 Keyboard Computer-US Layout', 'price': '316', 'quantity': '1'}]",
297,Control WS2812B NeoPixel LED Stick Using Raspberry Pi Pico,RE-EDIT,FALSE,FALSE,FALSE,FALSE,FALSE,FALSE,Edit Thumbnail,,Control LED strip with Pico + CircuitPython.,2021-03-12,education,2624,0,suadanwar,Tutorial,Beginner,"MY, SG, TH, VN, WWW",RPI Pico,TRUE,https://my.cytron.io/tutorial/control-ws2812b-neopixel-led-stick-using-raspberry-pi-pico,"['Raspberry Pi', 'Pico', 'Raspberry Pi']",,
298,Argon40 Mini Fan and The Matching Enclosure?,RE-EDIT,FALSE,FALSE,FALSE,FALSE,FALSE,FALSE,Edit Thumbnail,,Review of Argon40 fan & enclosure.,2021-03-14,education,1532,0,haikal,Protip,Not a project,"MY, SG, TH, VN, WWW",Raspberry Pi,TRUE,https://my.cytron.io/tutorial/argon40-mini-fan-and-the-matching-enclosure,['Raspberry Pi'],,
299,Blynk Video Streaming Using Raspberry Pi Camera,RE-EDIT,FALSE,FALSE,FALSE,FALSE,FALSE,FALSE,Edit Thumbnail,,Stream video from Pi Camera via Blynk.,2021-03-16,education,2744,0,Idris,Tutorial,Intermediate,"MY, SG, TH, VN, WWW",Raspberry Pi,TRUE,https://my.cytron.io/tutorial/blynk-video-streaming-using-raspberry-pi-camera,"['Raspberry Pi', 'Blynk', 'Video Streaming', 'Raspberry Pi', 'Wireless & IoT']",,
300,"Building Line Following Robot Using Maker Pi Pico, Maker Drive and Maker Line",RE-EDIT,FALSE,FALSE,FALSE,FALSE,FALSE,FALSE,Edit Thumbnail,,Build line follower robot using Maker Pi Pico.,2021-03-17,education,4305,0,Bhavithiran,Project,Intermediate,"MY, SG","RPI Pico, Robotics",TRUE,https://my.cytron.io/tutorial/building-line-following-robot-using-maker-pi-pico-maker-drive-and-maker-line,"['Line Following Robot', 'Raspberry Pi', 'Maker Drive', 'Maker Line', 'MicroPython', 'Raspberry Pi Pico', 'Maker Pi Pico', 'Raspberry Pi', 'Motor Driver', 'Makers', 'Python for MCU', 'Line Following Robot']","[{'name': '4xAA Battery Holder C/W Cover', 'price': '3', 'quantity': '1'}, {'name': 'USB Micro B Cable', 'price': '4', 'quantity': '1'}, {'name': 'Grove 4 Pin Buckled to Female Cable', 'price': '1', 'quantity': '1'}, {'name': 'Aluminum 2WD TT Robot/Motor Chassis - Purple', 'price': '49', 'quantity': '1'}, {'name': 'Bracket for Ultrasonic HC-SR04', 'price': '1', 'quantity': '1'}, {'name': 'Maker Drive: Simplifying H-Bridge Motor Driver for Beginner', 'price': '18', 'quantity': '1'}, {'name': '3V-5.5V SR04P Ultrasonic Ranging Module', 'price': '4', 'quantity': '1'}, {'name': 'Maker Line: Simplifying Line Sensor For Beginner', 'price': '43', 'quantity': '1'}, {'name': 'PKCELL Heavy Duty AA Battery (4pcs)', 'price': '1', 'quantity': '1'}, {'name': 'Maker Pi Pico: Simplifying Raspberry Pi Pico for Beginners', 'price': '48', 'quantity': '1'}]",
301,Control and Monitor Sensor Data on ESP32 Using Blynk BLE,RE-EDIT,FALSE,FALSE,FALSE,FALSE,FALSE,FALSE,Edit Thumbnail,,Use ESP32 to monitor multiple sensors IoT-style.,2021-03-23,education,2472,0,Idris,Tutorial,Beginner,"MY, SG, TH, VN, WWW",IoT/ESP32,TRUE,https://my.cytron.io/tutorial/control-and-monitor-sensor-data-on-esp32-using-blynk-ble,"['Arduino', 'Bluetooth', 'Arduino Ecosystem', 'Wireless & IoT']",,
302,Barrier Gate with RBT Kit Tahun 5,RE-EDIT,FALSE,TRUE,FALSE,FALSE,FALSE,FALSE,,,Build barrier gate system using Arduino + RBT kit.,2021-03-24,education,1214,0,suadanwar,Tutorial,Beginner,"MY, SG, TH, VN, WWW",Arduino,TRUE,https://my.cytron.io/tutorial/barrier-gate-with-rbt-kit-tahun-5,"['Arduino', 'RBT', 'rbt tahun 5', 'Arduino Ecosystem']",,
303,Keypad Solenoid Door Lock Using Arduino,RE-EDIT,FALSE,FALSE,FALSE,FALSE,FALSE,FALSE,Edit Thumbnail,,Unlock door using keypad + Arduino relay.,2021-03-26,education,2478,0,suadanwar,Tutorial,Beginner,"MY, SG, TH, VN, WWW",Arduino,TRUE,https://my.cytron.io/tutorial/arduino-solenoid-door-lock-using-keypad,"['Arduino', 'RBT', 'Arduino Ecosystem', 'Makers']",,
304,Program Maker Pi Pico and ESP01 with Blynk IoT App using Arduino IDE,RE-EDIT,FALSE,FALSE,FALSE,FALSE,FALSE,FALSE,Edit Thumbnail,,Connect Pico + ESP01 WiFi for IoT with Blynk.,2021-03-31,education,2849,0,Idris,Tutorial,Beginner,"MY, SG, TH, VN, WWW","RPI Pico, IoT/ESP32",TRUE,https://my.cytron.io/tutorial/program-maker-pi-pico-and-esp01-with-blynk-iot-app-using-arduino-ide,"['Arduino', 'Raspberry Pi Pico', 'Arduino Ecosystem', 'Raspberry Pi', 'Wireless & IoT']","[{'name': 'USB Micro B Cable', 'price': '4', 'quantity': '1'}, {'name': 'ESP-01 WiFi Serial Transceiver Module (ESP8266)', 'price': '7', 'quantity': '1'}, {'name': 'Raspberry Pi Pico', 'price': '19', 'quantity': '1'}, {'name': 'Maker Pi Pico: Simplifying Raspberry Pi Pico for Beginners', 'price': '48', 'quantity': '1'}, {'name': 'Maker Pi Pico Base (without Pico): Simplifying Pi Pico for Beginners', 'price': '36', 'quantity': '1'}]",
305,3.3V Serial LCD with Raspberry Pi Pico via SPI or I2C,RE-EDIT,FALSE,FALSE,FALSE,FALSE,FALSE,FALSE,Edit Thumbnail,,Using 3.3V Serial LCD with Raspberry Pi Pico via multiple interfaces.,2021-04-03,education,4472,0,haikal,Tutorial,Beginner,"MY, SG, TH, WWW",RPI Pico,TRUE,https://my.cytron.io/tutorial/3-3v-serial-lcd-with-raspberry-pi-pico-via-spi-or-i2c,"['RaspberryPiPico', 'SerialLCD', 'SPI', 'I2C', 'EmbeddedSystems', 'CircuitPython', 'Microcontroller', 'Display', 'Maker', 'Hardware', 'Raspberry Pi']","[{'name': 'Breadboard 16.5x5.5cm (830 Holes)', 'price': '3', 'quantity': '1'}, {'name': '3V3 I2C and SPI 1602 Serial Character LCD', 'price': '18', 'quantity': '1'}, {'name': 'Raspberry Pi Pico Microcontroller Board', 'price': '19', 'quantity': '1'}]",
306,Play MP3 File on Maker Pi Pico Using CircuitPython,RE-EDIT,FALSE,FALSE,FALSE,FALSE,FALSE,FALSE,Edit Thumbnail,,Audio playback with Pico and CircuitPython.,2021-04-13,education,4079,0,Idris,Tutorial,Beginner,"MY, SG, TH, WWW",RPI Pico,TRUE,https://my.cytron.io/tutorial/play-mp3-file-on-maker-pi-pico-using-circuitpython,"['MakerPiPico', 'MP3', 'Audio', 'Playback', 'CircuitPython', 'RaspberryPi', 'Pico', 'DIY', 'STEM', 'Electronics', 'Raspberry Pi', 'Python for MCU']","[{'name': 'Raspberry Pi Pico', 'price': '19', 'quantity': '1'}, {'name': 'Maker Pi Pico: Simplifying Raspberry Pi Pico for Beginners', 'price': '48', 'quantity': '1'}, {'name': 'Maker Pi Pico Base (without Pico): Simplifying Pi Pico for Beginners', 'price': '36', 'quantity': '1'}]",
