,1196,,,,,,,,,,,,,,,,,,,,,,,,
,1206,,,,,,,,,,,,,,,,,,,,,,,,
,99.1708126,0.8291873964,,,,,,,,,,,,,,,,,,,,,,,
,,,,,,,,,,,,,,,,,,,,,,,,,
No,Tutorial,Status,Content,Thumbnail,Product Link,Banner,Tracking,Publish Date,Need To Do,Revamp by,Description,Date,Category,View,Like,Authors,Type,Level,Store,Topic,Information,Link,Tag,Hardware,Remarks
1,You need Arduino?,DISABLE,FALSE,TRUE,TRUE,TRUE,FALSE,,,,Announcement of Cytron distributing Arduino boards in response to demand.,2010-07-29,education,1008,0,Ober,News,Not a project,"MY, SG, TH, VN, WWW",Arduino,TRUE,https://my.cytron.io/tutorial/you-need-arduino,"['Arduino', 'Duemilanove', 'Arduino Ecosystem']",,
2,All in One Super Charger!,UPDATED,TRUE,TRUE,TRUE,TRUE,FALSE,,,,"Introduction of a universal charger supporting LiPo, SLA, and more.",2010-10-21,education,1088,0,Ober,News,Not a project,"MY, SG, TH, VN, WWW",Electronic,TRUE,https://my.cytron.io/tutorial/all-in-one-super-charger,"['battery charger', 'Lipo', 'SLA', 'News']",,
3,An Arduino Room Monitoring Web Server,RE-EDIT,FALSE,TRUE,TRUE,TRUE,FALSE,FALSE,,,Build a web server using Arduino + Ethernet shield to monitor room conditions.,2011-07-27,education,3944,0,waiweng83,Tutorial,Intermediate,"MY, SG, TH, VN, WWW",Arduino,TRUE,https://my.cytron.io/tutorial/an-arduino-room-monitoring-web-server,"['Arduino', 'ethernet', 'web server', 'Arduino Ecosystem']",,
4.1,Getting Started with Arduino: From LED to Motor Control,DISABLE,TRUE,TRUE,FALSE,FALSE,FALSE,FALSE,,,,,education,,,,Tutorial,Beginner,,Arduino,,,,,
4,PROJECT 1 - LED DICE,DISABLE,FALSE,FALSE,FALSE,FALSE,FALSE,FALSE,,,Create an electronic dice using LEDs with Arduino.,2011-08-12,education,1484,0,tonynwk88,Tutorial,Beginner,"MY, SG, TH, VN, WWW",Arduino,TRUE,https://my.cytron.io/tutorial/project-0-led-dice,"['Digital output of Arduino', 'LED', 'Arduino Ecosystem']",,
5,PROJECT 2 - LED CHASER,DISABLE,FALSE,FALSE,FALSE,FALSE,FALSE,FALSE,,,Implement LED chaser sequence on Arduino board.,2011-08-12,education,1148,0,tonynwk88,Tutorial,Beginner,"MY, SG, TH, VN, WWW",Arduino,TRUE,https://my.cytron.io/tutorial/project-3-led-chaser,"['Arduino LED control', 'Arduino Ecosystem']",,
6,PROJECT 3 - TEMPERATURE SENSOR TO LCD DISPLAY,DISABLE,FALSE,FALSE,FALSE,FALSE,FALSE,FALSE,,,Displaying LM35 sensor data on an LCD with Arduino.,2011-08-12,education,1268,0,tonynwk88,Tutorial,Beginner,"MY, SG, TH, VN, WWW",Arduino,TRUE,https://my.cytron.io/tutorial/project-6-temperature-sensor-to-lcd-display,"['Arduino', 'LCD', 'LM35 temperature sensor', 'Arduino Ecosystem']",,
7,PROJECT 4 - ANALOG DISTANCE SENSOR TO LCD DISPLAY,DISABLE,FALSE,FALSE,FALSE,FALSE,FALSE,FALSE,,,Use Sharp IR distance sensor to measure distance and display on LCD.,2011-08-13,education,1097,0,tonynwk88,Tutorial,Beginner,"MY, SG, TH, VN, WWW",Arduino,TRUE,https://my.cytron.io/tutorial/project-8-analog-distance-sensor-to-lcd-display,"['Arduino', 'sharp distance sensor', 'Infrared range finder', 'Distance on LCD', 'Arduino Ecosystem']",,
8,PROJECT 5 - LM35 CONTROL DC MOTOR SPEED,DISABLE,FALSE,FALSE,FALSE,FALSE,FALSE,FALSE,,,Control DC motor speed with LM35 temperature sensor and Arduino.,2011-08-13,education,2674,0,tonynwk88,Tutorial,Beginner,"MY, SG, TH, VN, WWW",Arduino,TRUE,https://my.cytron.io/tutorial/project-9-lm35-control-dc-motor-speed,"['LM35', 'temperature control', 'DC motor', '2A Motor Driver Shield', 'Arduino Ecosystem', 'Motor Driver']",,
9,PROJECT 6 - SERIAL COMMUNICATION CONTROL RC SERVO,DISABLE,FALSE,FALSE,FALSE,FALSE,FALSE,FALSE,,,Control RC servos via serial communication using Arduino.,2011-08-13,education,1804,0,tonynwk88,Tutorial,Beginner,"MY, SG, TH, VN, WWW",Arduino,TRUE,https://my.cytron.io/tutorial/project-10-serial-communication-control-rc-servo,"['RC servo', 'Arduino', 'Serial control', 'Arduino Ecosystem', 'Motor Driver']",,
10,PROJECT 7 - SERIAL COMMUNICATION CONTROL DC MOTOR,DISABLE,FALSE,FALSE,FALSE,FALSE,FALSE,FALSE,,,Tutorial on controlling DC motor via serial communication with Arduino.,2011-08-13,education,1254,0,tonynwk88,Tutorial,Beginner,"MY, SG, TH, VN, WWW",Arduino,TRUE,https://my.cytron.io/tutorial/project-12-serial-communication-control-dc-motor,"['motor', 'Arduino', 'Control', 'Serial', 'LM35 temperature sensor', '2A Motor Driver Shield', 'Arduino Ecosystem', 'Motor Driver']",,
11,How does Stepper Motor Works - Part 1,UPDATED,TRUE,TRUE,TRUE,TRUE,FALSE,FALSE,,,Introduction to unipolar/bipolar stepper motors and working principles.,2012-03-10,education,4258,0,Ober,Protip,Beginner,"MY, SG, TH, WWW",Motor,TRUE,https://my.cytron.io/tutorial/how-does-stepper-motor-works-part-1,"['Stepper Motor', 'Unipolar', 'Bipolar', 'Hybrid Stepper', '2 phase stepper', '3 phase stepper', 'Motor Driver']","[{'name': '35BY48L Stepper Motor', 'price': '16', 'quantity': '1'}, {'name': '5V 28BYJ-48 Stepper Motor + ULN2003 Driver Board', 'price': '8', 'quantity': '1'}, {'name': 'NEMA 17HS4401 Bipolar Stepper Motor', 'price': '39', 'quantity': '1'}, {'name': '12V 28BYJ-48 Stepper Motor + ULN2003 Driver Board', 'price': '8', 'quantity': '1'}]",
12,How Does Stepper Motor Works - Part 2,UPDATED,TRUE,TRUE,TRUE,TRUE,FALSE,FALSE,,,"Extended explanation on stepper motors, including hybrid motors.",2012-05-13,education,7020,0,Ober,Protip,Beginner,"MY, SG, TH, VN, WWW",Motor,TRUE,https://my.cytron.io/tutorial/how-does-stepper-motor-works-part-2,,,
13,MD10C Fast Testing,UPDATED,FALSE,TRUE,TRUE,FALSE,FALSE,FALSE,,,Quick test guide for MD10C motor driver.,2012-09-11,education,3454,0,ktchen89,Tutorial,Beginner,"MY, SG, TH, VN, WWW",Motor/Motor Driver,TRUE,https://my.cytron.io/tutorial/md10c-fast-testing,"['Motor Driver', 'MD10C', 'fast test', 'Motor Driver']",,
14,Getting Started with Arduino Uno,UPDATED,FALSE,TRUE,FALSE,TRUE,FALSE,FALSE,,,Beginner tutorial for Arduino Uno setup and first program.,2012-11-14,education,5565,1,Ober,Tutorial,Beginner,"MY, SG, WWW",Arduino,TRUE,https://my.cytron.io/tutorial/getting-started-with-arduino-uno,"['Arduino Uno', 'Beginner Guide', 'Microcontroller', 'DIY Electronics', 'Programming', 'Embedded Systems', 'Maker Projects', 'Arduino IDE', 'Electronics', 'Getting Started', 'Arduino Ecosystem']","[{'name': 'Arduino UNO WiFi Rev2.0 Dev Board', 'price': '279', 'quantity': '1'}, {'name': 'Maker UNO Edu Kit (Arduino Compatible)', 'price': '54', 'quantity': '1'}]",
15,Arduino Buying Guide,UPDATED,TRUE,TRUE,TRUE,TRUE,FALSE,FALSE,,,Comparison and guide to choosing Arduino boards.,2012-11-17,education,1688,0,Ober,Protip,Beginner,"MY, SG, TH, VN, WWW",Arduino,TRUE,https://my.cytron.io/tutorial/arduino-buying-guide-2,"['Arduino', 'DUE', 'buying guide', 'Different', 'Why Arduino', 'Arduino Ecosystem']",,
16,Getting Started with Arduino – PRO Mini,UPDATED,TRUE,TRUE,TRUE,TRUE,FALSE,FALSE,,,Beginner guide to using Arduino Pro Mini board with UC00A USB-to-serial adapter.,2012-11-24,education,2430,0,Ober,Tutorial,Beginner,"MY, SG, TH, VN, WWW",Arduino,TRUE,https://my.cytron.io/tutorial/getting-started-arduino-pro-mini,"['Arduino', 'PRO Mini', 'UC00A Rev2.0', 'Arduino Ecosystem']",,
17,Controlling MD10C with Arduino,DISABLE,FALSE,FALSE,FALSE,FALSE,FALSE,FALSE,Edit Thumbnail,,Tutorial on using Arduino to drive MD10C motor driver.,2013-07-29,education,6122,0,bengchet,Tutorial,Beginner,"MY, SG, TH, VN, WWW","Arduino, Motor/Motor Driver",TRUE,https://my.cytron.io/tutorial/controlling-md10c-with-arduino,"['Motor Driver', 'Control', 'MD10C', 'Signed Magnitude', 'Locked Anti Phase', 'Motor Driver']",,
19,Moisture sensor module (SN-MOISTURE-MOD),UPDATED,FALSE,TRUE,TRUE,TRUE,FALSE,FALSE,,,Intro to Arduino-compatible soil moisture sensor.,2014-07-07,education,2478,0,khlim8,Tutorial,Beginner,"MY, SG, TH, VN, WWW","Electronic, Arduino",TRUE,https://my.cytron.io/tutorial/moisture-sensor-module-sn-moisture-mod,"['arduino uno', 'moisture sensor', 'Sensor']",,
20,Rain Sensor Module (SN-RAIN-MOD),UPDATED,TRUE,TRUE,TRUE,TRUE,FALSE,FALSE,,,Intro to Arduino-compatible rain detection sensor.,2014-07-08,education,2457,0,khlim8,Tutorial,Beginner,"MY, SG, TH, VN, WWW","Electronic, Arduino",TRUE,https://my.cytron.io/tutorial/rain-sensor-module-sn-rain-mod,"['arduino uno', 'rain sensor module', 'Sensor']",,
21,Introducing CT-UNO!,UPDATED,TRUE,TRUE,TRUE,TRUE,FALSE,FALSE,,,Launch of Cytron’s Arduino UNO-compatible board.,2014-11-04,education,2278,0,Idris,News,Not a project,"MY, SG, WWW",Arduino,TRUE,https://my.cytron.io/tutorial/introducing-ct-uno,"['CT-UNO', 'Arduino Ecosystem']","[{'name': 'Cytron UNO - Arduino UNO Compatible', 'price': '58', 'quantity': '1'}]",
22,Raspberry Pi + Processing + CT UNO,DISABLE,FALSE,FALSE,FALSE,FALSE,FALSE,FALSE,Edit Thumbnail,,Integration of Raspberry Pi with Processing and CT UNO.,2014-11-07,education,1436,0,Idris,Project,Intermediate,"MY, SG, TH, VN, WWW","Arduino, Raspberry Pi",TRUE,https://my.cytron.io/tutorial/raspberry-pi-processing-ct-uno-part-1,"['Arduino', 'Raspberry Pi', 'java', 'Intermediate', 'Arduino Ecosystem', 'Raspberry Pi']",,
23,Raspberry Pi + Processing + CT UNO (Part 2),DISABLE,FALSE,FALSE,FALSE,FALSE,FALSE,FALSE,Edit Thumbnail,,Continuation of Raspberry Pi & CT UNO integration tutorial.,2014-11-07,education,997,0,Idris,Project,Intermediate,"MY, SG, WWW","Arduino, Raspberry Pi",TRUE,,,,
24,Cytron Uno Starter Kit Book,UPDATED,TRUE,TRUE,TRUE,TRUE,FALSE,FALSE,,,Book/manual for Cytron’s Arduino starter kit.,2015-01-05,education,1535,0,Idris,News,Not a project,"MY, SG, WWW",Arduino,TRUE,https://my.cytron.io/tutorial/cytron-uno-starter-kit-book,"['CT-UNO', 'Starter Kit', 'Cytron uno', 'Arduino Ecosystem', 'News']","[{'name': 'Starter Kit for Cytron Uno', 'price': '105', 'quantity': '1'}]",
25,Sensing: Vibration and Tilt,UPDATED,TRUE,TRUE,TRUE,TRUE,FALSE,FALSE,,,Using vibration and tilt sensors with microcontrollers.,2015-04-04,education,3181,0,geneccyann,Tutorial,Beginner,"MY, SG, TH, VN, WWW",Arduino,TRUE,https://my.cytron.io/tutorial/sensing-vibration-tilt,"['Microcontroller', 'Vibration Sensor', 'Tilt sensor', 'Sensor']",,
26,Using MDD10A with ARDUINO UNO,UPDATED,TRUE,TRUE,TRUE,TRUE,FALSE,FALSE,,,Driving dual DC motors with MDD10A and Arduino Uno.,2015-04-05,education,3165,0,geneccyann,Tutorial,Beginner,"MY, SG, TH, VN, WWW","Arduino, Motor/Motor Driver",TRUE,https://my.cytron.io/tutorial/using-mdd10a-arduino-uno,"['Motor Driver', 'arduino uno', 'CT-UNO', 'MDD10A', 'Arduino Ecosystem', 'Motor Driver']",,
27,Arduino + PS2 shield + MDDS10 for mobile robot control,UPDATED,TRUE,TRUE,TRUE,TRUE,FALSE,FALSE,,,"Build a mobile robot with Arduino, PS2 shield, and MDDS10 motor driver.",2015-06-24,education,3671,0,suadanwar,Tutorial,Beginner,"MY, SG, TH, VN, WWW","Arduino, Motor/Motor Driver",TRUE,https://my.cytron.io/tutorial/arduino-ps2-shield-mdds10-mobile-robot-control,"['Arduino', 'wireless', 'DC motor', 'Serial Communication', 'robots', 'smartdriveduo-10', 'cytron ps2 shield', 'Arduino Ecosystem', 'Motor Driver']",,
28,ESP8266 Tutorial Part I - Getting Started,RE-EDIT,FALSE,FALSE,FALSE,FALSE,FALSE,FALSE,Edit Thumbnail,,Introduction to ESP8266 WiFi module with Arduino.,2015-06-30,education,1701,0,bengchet,Tutorial,Beginner,"MY, SG, TH, VN, WWW",IoT/ESP32,TRUE,https://my.cytron.io/tutorial/getting-started-wifi-serial-transceiver-module-esp8266,"['WiFi', 'Arduino Compatible', 'ESP8266', 'Wireless & IoT']",,
29,Improve MDDS10 Performance With External Fan,UPDATED,TRUE,TRUE,TRUE,TRUE,FALSE,FALSE,,,Guide to cooling MDDS10 motor driver using external fan.,2015-07-13,education,2114,0,Idris,Protip,Beginner,"MY, SG, TH, WWW",Motor/Motor Driver,TRUE,https://my.cytron.io/tutorial/improve-mdds10-performance-external-fan,"['Motor Driver', 'MDDS10', 'fan', 'higher current', 'maximum', 'Motor Driver']","[{'name': '10Amp 7V-35V SmartDrive DC Motor Driver (2 Channels)', 'price': '220', 'quantity': '1'}]",
30,4x4x4 LED Cube using Arduino UNO without extra IC,RE-EDIT,FALSE,FALSE,FALSE,FALSE,FALSE,FALSE,Edit Thumbnail,,Tutorial to build 4x4x4 LED cube with Arduino Uno (no extra ICs).,2015-08-17,education,2777,0,OoiBP,Tutorial,Beginner,"MY, SG, TH, VN, WWW",Arduino,TRUE,https://my.cytron.io/tutorial/4x4x4-led-cube-using-arduino-uno-without-extra-ic,"['Arduino', 'LED', 'LED cube', 'cube', 'Arduino Ecosystem', 'Miscellaneous']",,
31,Raspberry Pi: LED Blinking using Python,UPDATED,FALSE,FALSE,FALSE,FALSE,FALSE,FALSE,Edit Thumbnail,,Beginner tutorial for LED blinking on Raspberry Pi using Python.,2015-08-21,education,1554,0,Idris,Tutorial,Beginner,"MY, SG, TH, VN, WWW",Raspberry Pi,TRUE,https://my.cytron.io/tutorial/raspberry-pi-led-blinking-using-python,"['LED', 'Beginner', 'Raspberry Pi', 'python', 'Raspberry Pi']",,
32,How to choose a suitable DC motor?,RE-EDIT,FALSE,FALSE,FALSE,FALSE,FALSE,FALSE,Remake,,Guide to selecting the right DC motor for projects.,2015-08-28,education,3873,0,fatehah,Protip,Beginner,"MY, SG, TH, VN, WWW",Motor/Motor Driver,TRUE,https://my.cytron.io/tutorial/choose-suitable-motor,"['RC servo', 'motor', 'Motor Driver', 'DC motor', 'Encoder', 'Stepper Motor', 'buying guide', 'robots', 'Motor Driver']",,
33,Arduino + 2A Motor Shield + Encoder Motor,UPDATED,TRUE,TRUE,TRUE,TRUE,FALSE,FALSE,,,Controlling motors with Arduino and 2A Motor Shield.,2016-04-04,education,5655,0,dreamer,Tutorial,Beginner,"MY, SG, TH, VN, WWW","Arduino, Motor/Motor Driver",TRUE,https://my.cytron.io/tutorial/arduino-2a-motor-shield-encoder-motor,"['motor', 'Arduino', 'lcd keypad shield', 'Encoder', 'CT-UNO', 'resistor', 'cytron screw terminal shield', '2amp motor driver shield', 'IG32E35K', 'ACTUATOR', 'Arduino Ecosystem', 'Motor Driver']",,
34,Raspberry Pi: GUI with a Remote Desktop Connection,UPDATED,FALSE,FALSE,FALSE,FALSE,FALSE,FALSE,Revamp,,Setup Raspberry Pi GUI access using Remote Desktop.,2016-07-15,education,1859,0,Khairul_Tajudin,Tutorial,Beginner,"MY, SG, TH, VN, WWW",Raspberry Pi,TRUE,https://my.cytron.io/tutorial/raspberry-pi-gui-remote-desktop-connection,"['wireless', 'GUI', 'Remote monitor', 'WiFi', 'USB to UART', 'Raspberry Pi', 'TP-LINK WIFI DONGLE', 'Intermediate', 'Raspberry Pi']",,
35,Raspberry Pi: Control DC Motor using MDDS10,UPDATED,FALSE,FALSE,FALSE,FALSE,FALSE,FALSE,Revamp,,Control DC motor with Raspberry Pi + MDDS10 driver.,2016-07-26,education,5543,0,Khairul_Tajudin,Tutorial,Beginner,"MY, SG, TH, WWW","Raspberry Pi, Motor/Motor Driver",TRUE,https://my.cytron.io/tutorial/raspberry-pi-control-dc-motor-using-mdds10,"['jumper wire', 'Motor Driver', 'DC motor', 'Lipo', 'autonomous robot controller', 'smartdriveduo-10', 'robot chassis', 'Raspberry Pi', 'TP-LINK WIFI DONGLE', 'controller', 'Intermediate', 'Raspberry Pi', 'Motor Driver']","[{'name': '10Amp 7V-35V SmartDrive DC Motor Driver (2 Channels)', 'price': '220', 'quantity': '1'}, {'name': 'Raspberry Pi 3 Model B', 'price': '163', 'quantity': '1'}]",
36,Peak Current vs Continuous/Rated Current,UPDATED,TRUE,TRUE,TRUE,TRUE,FALSE,FALSE,,,Explains difference between peak and continuous current for motors.,2016-12-01,education,36368,0,Khairul_Tajudin,Protip,Not a project,"MY, SG, TH, WWW",Motor/Motor Driver,TRUE,https://my.cytron.io/tutorial/peak-current-vs-continuousrated-current,"['Motor Driver', 'MDDS10', 'MD13S', 'Comparison', 'Continuous current', 'Peak Current', 'Motor Driver']","[{'name': '10Amp 7V-35V SmartDrive DC Motor Driver (2 Channels)', 'price': '220', 'quantity': '1'}, {'name': '60Amp 7V-45V SmartDrive DC Motor Driver (2 Channels)', 'price': '720', 'quantity': '1'}, {'name': '13Amp 6V-30V DC Motor Driver', 'price': '55', 'quantity': '1'}, {'name': '30Amp 7V-35V SmartDrive DC Motor Driver (2 Channels)', 'price': '316', 'quantity': '1'}]",
37,Let's Arduino Control Your SmartDriveDuo-60,UPDATED,TRUE,TRUE,TRUE,TRUE,FALSE,TRUE,,,Controlling SmartDriveDuo-60 motor driver with Arduino.,2017-01-25,education,2779,0,Idris,Tutorial,Beginner,"MY, SG, VN, WWW","Arduino, Motor/Motor Driver",TRUE,https://my.cytron.io/tutorial/lets-arduino-control-smartdriveduo-60,"['robot', 'Arduino', 'CT-UNO', 'MDDS60', 'Motor Driver']","[{'name': '60Amp 7V-45V SmartDrive DC Motor Driver (2 Channels)', 'price': '720', 'quantity': '1'}]",
38,Let’s Arduino Control Your SmartDriveDuo-10,UPDATED,TRUE,TRUE,TRUE,TRUE,FALSE,TRUE,,,Control SmartDriveDuo-10 dual channel motor driver.,2017-03-13,education,2421,0,muhammadzaihanif_,Tutorial,Beginner,"MY, SG, TH, VN, WWW","Arduino, Motor/Motor Driver",TRUE,https://my.cytron.io/tutorial/lets-arduino-control-smartdriveduo-10,"['smartdriveduo10', '10A motor driver', 'mdds10 smartdriveduo-10', '2x10A', 'RC mode', 'PWM Driver', '2 Channel', 'Arduino Ecosystem', 'Motor Driver']",,
39,Controlling MD10C DC Motor Driver Using Arduino Nano,UPDATED,TRUE,TRUE,TRUE,TRUE,FALSE,FALSE,,,Tutorial on using Arduino Nano with MD10C driver.,2017-03-15,education,29287,0,Bhavithiran,Tutorial,Beginner,"MY, SG, TH, WWW","Arduino, Motor/Motor Driver",TRUE,https://my.cytron.io/tutorial/controlling-10a-dc-motor-driver-using-arduino-nano,"['MD10C', 'Arduino Nano', 'Arduino Nano', 'DC Motor Driver', 'Motor Control', 'Electronics', 'DIY Projects', 'Motor Driver', 'Embedded Systems', 'Arduino', 'DC Motor', '10A Motor', 'Motor Driver']","[{'name': '10Amp 5V-30V DC Motor Driver', 'price': '55', 'quantity': '1'}, {'name': 'Arduino Nano Main Board', 'price': '139', 'quantity': '1'}, {'name': 'Maker Nano: Simplifying Arduino for Projects', 'price': '35', 'quantity': '1'}, {'name': '12V 580RPM 3.5kgfcm GM25 High Power Brushed DC Geared Motor', 'price': '49', 'quantity': '1'}]",
40,Installing Raspbian OS on Raspberry Pi for Windows,DISABLE,FALSE,FALSE,FALSE,FALSE,FALSE,FALSE,Edit Thumbnail,,Step-by-step OS installation using Windows.,2017-04-25,education,2833,0,Idris,Tutorial,Beginner,"MY, SG, TH, VN, WWW",Raspberry Pi,TRUE,https://my.cytron.io/tutorial/installing-raspbian-os-raspberry-pi-windows,"['Beginner', 'Raspberry Pi', 'Raspbian OS', 'Raspberry Pi']",,
41,Getting Started with Raspberry Pi Zero W,UPDATED,FALSE,FALSE,FALSE,FALSE,FALSE,FALSE,Edit Thumbnail,,Introductory tutorial for Raspberry Pi Zero W.,2017-05-02,education,3186,0,Idris,Tutorial,Beginner,"MY, SG, TH, VN, WWW",Raspberry Pi,TRUE,https://my.cytron.io/tutorial/getting-started-raspberry-pi-zero-w,"['Beginner', 'Raspberry Pi']",,
42,Introducing 30A Dual Channel DC Motor Driver with Smart Features - SmartDriveDuo-30,RE-EDIT,FALSE,FALSE,FALSE,FALSE,FALSE,FALSE,Remake,,Product launch of SmartDriveDuo-30 motor driver.,2017-06-06,education,4524,0,Idris,News,Not a project,"MY, SG, TH, VN, WWW",Motor/Motor Driver,TRUE,https://my.cytron.io/tutorial/introducing-30a-dual-channel-dc-motor-driver-smart-features-smartdriveduo-30,"['SmartDriveDuo-30', 'DC motor driver', 'dual channel', 'high power motor driver', 'smart motor control', 'PWM control', 'Arduino', 'Raspberry Pi', 'robotics', 'motor automation', 'Motor Driver']","[{'name': '30Amp 7V-35V SmartDrive DC Motor Driver (2 Channels)', 'price': '316', 'quantity': '1'}]",
43,Getting Started with 3A Motor Driver Shield and Arduino Uno,UPDATED,TRUE,TRUE,TRUE,TRUE,FALSE,TRUE,,,Control DC motors with 3A Motor Driver Shield.,2017-06-15,education,3865,0,Idris,Tutorial,Beginner,"MY, SG, TH, WWW","Arduino, Motor/Motor Driver",TRUE,https://my.cytron.io/tutorial/getting-started-3a-motor-driver-shield,"['Arduino', 'Motor Driver', 'Arduino Shield', 'Motor Driver']","[{'name': '0.8Amp 5V-26V DC Motor Driver Shield for Arduino (2 Channels)', 'price': '48', 'quantity': '1'}, {'name': '1.2Amp 7V-30V DC Motor Driver Shield for Arduino (2 Channels)', 'price': '79', 'quantity': '1'}]",
44,Getting Started with Light Sensor Module (SN-LIGHT-MOD),RE-EDIT,FALSE,FALSE,FALSE,FALSE,FALSE,FALSE,Edit Thumbnail,,Tutorial on SN-LIGHT-MOD Arduino-compatible module.,2017-07-10,education,3530,0,SC,Tutorial,Beginner,"MY, SG, TH, VN, WWW",Arduino,TRUE,https://my.cytron.io/tutorial/getting-started-light-sensor-module-sn-light-mod,"['Cytron', 'sensor', 'Arduino', 'CT-UNO', 'SN-LIGHT-MOD', 'Light Sensor Module', 'Sensor']",,
45,Getting Started with Encoder Sensor Module (SN-ENC-MOD),RE-EDIT,FALSE,FALSE,FALSE,FALSE,FALSE,FALSE,Edit Thumbnail,,Tutorial on SN-ENCODER-MOD module for Arduino.,2017-07-12,education,2620,0,SC,Tutorial,Beginner,"MY, SG, TH, VN, WWW",Arduino,TRUE,https://my.cytron.io/tutorial/getting-started-encoder-sensor-module-sn-enc-mod,"['Motor Driver', 'DC motor', 'CT-UNO', 'Encoder Sensor Module', 'Sensor']",,
46,Getting Started with Temperature Sensor (Celsius) (SN-LM35DZ),RE-EDIT,FALSE,FALSE,FALSE,FALSE,FALSE,FALSE,Edit Thumbnail,,Using LM35/Celsius sensor with Arduino.,2017-07-13,education,1660,0,SC,Tutorial,Beginner,"MY, SG, TH, VN, WWW",Arduino,TRUE,https://my.cytron.io/tutorial/getting-started-temperature-sensor-celsius-sn-lm35dz,"['Cytron', 'sensor', 'Arduino', 'Temperature sensor', 'CT-UNO', 'Sensor']",,
47,Getting Started with Mifare RC522 RFID Kit (RFID-RC522),RE-EDIT,FALSE,FALSE,FALSE,FALSE,FALSE,FALSE,Edit Thumbnail,,Beginner guide to MFRC522 RFID/NFC module.,2017-08-10,education,1905,0,SC,Tutorial,Beginner,"MY, SG, WWW",Arduino,TRUE,https://my.cytron.io/tutorial/getting-started-mifare-rc522-rfid-kit-rfid-rc522,"['RFID', 'MFRC522', 'Sensor']","[{'name': 'RFID/NFC Module Kit (13.56MHz)', 'price': '0', 'quantity': '1'}]",
48,Raspberry Pi Zero W and Pi Camera Application,UPDATED,FALSE,FALSE,FALSE,FALSE,FALSE,FALSE,Edit Thumbnail,,Example projects using Pi Zero W and Pi Camera.,2017-08-16,education,5080,0,SC,Tutorial,Beginner,"MY, SG, TH, VN, WWW",Raspberry Pi,TRUE,https://my.cytron.io/tutorial/raspberry-pi-zero-w-pi-camera-application,"['RaspberryPiZeroW', 'PiCamera', 'IoT', 'EmbeddedSystems', 'DIY', 'Maker', 'Electronics', 'HomeAutomation', 'Surveillance', 'RaspberryPi', 'Raspberry Pi']","[{'name': 'Raspberry Pi Zero W', 'price': '72', 'quantity': '1'}, {'name': '5MP OV5647 Camera Module for Raspberry Pi', 'price': '29', 'quantity': '1'}]",
49,[BM]Arduino VS Raspberry Pi- Perbezaan Asas Diantara Arduino dan Raspberry Pi,UPDATED,TRUE,TRUE,TRUE,TRUE,FALSE,FALSE,Edit Thumbnail,,Malay-language comparison of Arduino vs Raspberry Pi.,2017-10-27,education,1809,0,SC,Protip,Beginner,"MY, SG, TH, VN, WWW","Arduino, Raspberry Pi",TRUE,https://my.cytron.io/tutorial/arduino-vs-raspberry-pi-perbezaan-asas-diantara-arduino-dan-raspberry-pi,"['Beginner', 'arduino uno', 'raspberry pi 3', 'Arduino Ecosystem', 'Raspberry Pi']",,
50,Maker Uno IoT with ESP8266 Module and Blynk Apps – 1. Hardware Setup (BM),RE-EDIT,FALSE,FALSE,FALSE,FALSE,FALSE,FALSE,Edit Thumbnail,,Using ESP8266 with Maker UNO for IoT + Blynk.,2018-02-02,education,1529,0,Idris,Project,Beginner,"MY, SG, TH, VN, WWW","Arduino, IoT/ESP32",TRUE,https://my.cytron.io/tutorial/maker-uno-iot-esp8266-module-blynk-apps-1-hardware-setup-bm,"['arduino uno', 'ESP8266', 'IoT', 'Maker Uno', 'Internet of Things', 'Blynk', 'Arduino Ecosystem', 'Wireless & IoT']","[{'name': 'Breadboard 8.5x5.5cm (400 Holes)', 'price': '2', 'quantity': '1'}, {'name': 'ESP-01 WiFi Serial Transceiver Module (ESP8266)', 'price': '7', 'quantity': '1'}, {'name': 'Maker UNO: Simplifying Arduino for {Education}', 'price': '36', 'quantity': '1'}]",
51,Maker Uno IoT with ESP8266 Module and Blynk Apps – 2. Software Setup (BM),RE-EDIT,FALSE,FALSE,FALSE,FALSE,FALSE,FALSE,Edit Thumbnail,,Continuation of Maker UNO + ESP8266 IoT tutorial.,2018-02-12,education,1376,0,Idris,Project,Beginner,"MY, SG, TH, VN, WWW","Arduino, IoT/ESP32",TRUE,https://my.cytron.io/tutorial/maker-uno-iot-esp8266-module-blynk-apps-2-software-setup-bm,"['arduino uno', 'ESP8266', 'Maker Uno', 'Blynk', 'Arduino Ecosystem', 'Wireless & IoT']",,
52,Program Your Raspberry Pi 3 with Arduino Create (BM),DISABLE,FALSE,FALSE,TRUE,FALSE,FALSE,FALSE,Outdated,,Using Arduino Create to program Raspberry Pi 3.,2018-04-18,education,862,0,Idris,Protip,Intermediate,"MY, SG, TH, VN, WWW","Raspberry Pi, Arduino",TRUE,https://my.cytron.io/tutorial/program-raspberry-pi-3-arduino-create-bm,"['Beginner', 'Raspberry Pi', 'Arduino Create', 'Raspberry Pi']",,
53,How To Develop Arduino Line Following Mobile Robot,RE-EDIT,FALSE,FALSE,FALSE,FALSE,FALSE,FALSE,Edit Thumbnail,,Build line-following robot using Maker UNO.,2018-05-16,education,1786,0,Idris,Project,Advanced,"MY, SG, WWW","Arduino, Robotics",TRUE,https://my.cytron.io/tutorial/develop-arduino-line-following-mobile-robot,"['Arduino Ecosystem', 'Motor Driver', 'Line Following Robot']","[{'name': '0.8Amp 5V-26V DC Motor Driver Shield for Arduino (2 Channels)', 'price': '48', 'quantity': '1'}, {'name': 'LiPo Power Shield', 'price': '55', 'quantity': '1'}, {'name': 'Maker UNO: Simplifying Arduino for {Education}', 'price': '36', 'quantity': '1'}]",
54,How To Program Arduino (Maker UNO) Using Atmel Studio,RE-EDIT,FALSE,FALSE,FALSE,FALSE,FALSE,FALSE,Edit Thumbnail,,Tutorial on programming Arduino with Atmel Studio.,2018-06-06,education,3709,0,Idris,Protip,Beginner,"MY, SG, TH, VN, WWW",Arduino,TRUE,https://my.cytron.io/tutorial/program-arduino-maker-uno-using-atmel-studio,['Arduino Ecosystem'],"[{'name': 'Maker UNO: Simplifying Arduino for {Education}', 'price': '36', 'quantity': '1'}]",
55,Getting Started of I2C Serial LCD with Arduino (Maker UNO),RE-EDIT,FALSE,FALSE,FALSE,FALSE,FALSE,FALSE,Edit Thumbnail,,Tutorial for I2C Serial LCD display with Arduino.,2018-06-06,education,3099,0,Idris,Tutorial,Beginner,"MY, SG, TH, VN, WWW",Arduino,TRUE,https://my.cytron.io/tutorial/getting-started-i2c-serial-lcd-arduino-maker-uno,"['Arduino', 'Maker Uno', 'I2C LCD', 'LiquidCrystal', 'Arduino Ecosystem']","[{'name': 'Maker UNO: Simplifying Arduino for {Education}', 'price': '36', 'quantity': '1'}, {'name': 'I2C 1602 Serial LCD for Arduino & RPI', 'price': '11', 'quantity': '1'}]",
